post_id,cluster_id,text
1lhxtv2,3,I am a CISO/Security Leader. I am also a bald man with facial hair. Ask Me Anything.
1qdixhe,2,China sentences kingpin members of phishing call center to death. Yea!
1izq3a9,4,How to disable ACR on your TV (and why you shouldn't wait to do it)
1jc35st,2,Cybersecurity officials warn against potentially costly Medusa ransomware attacks
1ixs6kl,2,"The Australian Government has banned the use of Kaspersky Lab products and web services on all government systems and devices, after they were deemed to be unsafe."
1qmgzko,3,"Unpopular Opinion: Companies that offer ""Swag Only"" or ""Hall of Fame"" for critical vulnerabilities should be publicly shamed, not thanked."
1proggh,2,"New UEFI flaw enables pre-boot attacks on motherboards from Gigabyte, MSI, ASUS, ASRock"
1oqwjye,4,Take that help desk position. It will help you in the long run.
1l9n3eh,4,Copilot....you got some splaining to do.
1j1rfth,3,Researchers Make Scary Discovery About Apple's Find My Network
1ooiz0g,9,Top 15 web based OSINT tools (free) Enjoy!!
1m741ks,2,US Nuclear Weapons Agency Breached in Microsoft SharePoint Hack
1ksn79n,3,Why are we still obsessed with CVEs when misconfigs are doing most of the damage?
1onl2wq,2,Two men accused of hacking and extorting US companies previously worked for cybersecurity firms
1n6gus5,4,"The more I understand cybersecurity, the more I realize I don’t — is that part of the journey?"
1l83wwq,7,Report: Trump Administration Ignored Advice When Installing Starlink at the White House
1odkx7s,0,"Signal is critisized for relying on Amazon web services, which caused it to be affected by the recent outage"
1o17rhm,3,"Oh no, what a brilliant idea!! Age verification with ID uploads what could possibly go wrong?"
1pckox7,5,"Poetry can trick AI models into revealing nuclear weapons secrets, study finds"
1l9ijsn,4,There are way too many Career and AI questions in this sub.
1j75jae,2,Developer guilty of using kill switch to sabotage employer's systems
1odr1q0,2,Foreign hackers breached a US nuclear weapons plant via SharePoint flaws
1lk5ck1,7,"Jamie Dimon warns of a scary global labour crisis: JPMorgan CEO says 'world is short on skills, not people'"
1j11xij,0,The UK will neither confirm nor deny that it’s killing encryption
1quqynt,2,Russian hackers exploit recently patched Microsoft Office bug in attacks
1kvplj0,1,Looking for realistic hacker movies &amp; books
1jypt02,2,"SentinelOne: An Official Statement in Response to the April 9, 2025 Executive Order"
1jlyb0d,1,Oracle Health breach compromises patient data at US hospitals
1n7ntvi,1,SOC Analyst Job destroying my life.
1q3dxqx,0,Martha Root - A German hacktivist who infiltrated and wiped a far-right dating site.
1lnf5xn,0,Hiring Manager's Tips: Interviewing for Cybersecurity Jobs
1jtieox,4,"We are hackers, researchers, and cloud security experts at Wiz, Ask Us Anything!"
1p3s7d8,1,Gmail’s sneaky data grab
1onckfu,6,We built a deepfake of our own CEO — it took 90 minutes and free tools [Educational]
1k02ops,2,MITRE-backed cyber vulnerability program to lose funding Wednesday
1nveq29,2,CISA warns of critical Linux Sudo flaw exploited in attacks
1kf7avn,3,"I am bored! Tell me the craziest, most ridiculous alert you have seen on your SOC dashboard."
1q1wiin,9,"Europe has ‘lost the internet’, warns Belgium’s cyber security chief"
1qa44gy,2,Michigan man learns the hard way that “catch a cheater” spyware apps aren’t legal
1pzmcoa,2,US cybersecurity experts plead guilty to BlackCat ransomware attacks
1mpkhxi,3,YouTube Sparks Outrage With Age Check That Scans Your Viewing Habits to Decide If You're an Adult
1l4594i,1,Learning cybersecurity is overwhelming
1mptdpk,9,"Russian hackers took control of Norwegian dam, police chief says"
1iy4ojg,1,"""Signal leaves Sweden on government proposal for data storage club"". Will have to translate from Swedish to English. Sweden wants Signal &amp; What's app to include backdoors."
1qo8oq5,0,THE INVERTED PANOPTICON: Beijing Weaponized the West’s Own Wiretap Infrastructure to Execute the Greatest Intelligence Coup Since Cambridge Five
1j0vmq8,8,12K hardcoded API keys and passwords found in public LLM training data
1pqnze1,3,Is everyone actually miserable in this subreddit
1po2wbr,2,Thousands of Firefox users compromised
1ji1pwa,3,I’m a CISO who started from the help desk and it taught me everything I need to know about cybersecurity and people. Ask Me Anything
1kfynl2,9,Signal clone used by Trump official stops operations after report it was hacked &amp;#x2d; Ars Technica
1qea9jq,5,Researchers found a single-click attack that turns Microsoft Copilot into a data exfiltration tool
1lse773,1,Cybersecurity and Linkedin obsession?
1k97zkc,4,How do you respond to “Can you hack Instagram accounts?” when you tell someone you’re in cyber security?
1m5qea7,0,Sharepoint Hack
1k2x8lu,9,"CISA warns threat hunting staff of end to Google, Censys contracts as agency cuts set in"
1qgi2wd,2,Mandiant releases rainbow table that cracks weak admin password in 12 hours
1jmhc89,2,Honeypot on all ports. Results after 3 months
1ok34ao,2,Ransomware profits drop as victims stop paying hackers
1pkymuc,7,"Exclusive: Home Depot exposed access to internal systems for a year, says researcher"
1k02qfr,2,Federal employee alleges DOGE activity resulted in data breach at labor board
1md3zr6,6,Microsoft just released a list of 40 jobs most vulnerable to AI and cybersecurity roles aren't on it.
1m1a46i,0,What’s your funniest ‘false positive’ moment
1j91uc1,4,What password manager could you recommend in 2025?
1nq57vg,2,just saw an employee pasting an entire client contract into ChatGPT
1nk7njd,9,Russian fake-news network back in action with 200+ new sites
1neygpx,0,ESET discovered a new boot crypto ransomware that infects UEFI and bypasses Secure Boot
1mhoxi4,3,How many Cybersecurity Firms are just running automated scans and charging an arm and a leg for it?
1kh3un0,1,Got laid off in Cybersecurity
1j9ylge,2,CISA claims no red team employees were terminated: 'Statement on CISA's Red Team'
1l1sdbl,2,Microsoft + CrowdStrike create Rosetta Stone to untangle threat actor nicknames
1qodxkm,3,Let's Encrypt is moving to 45-day certificates before everyone else
1mllvrp,2,WinRAR zero-day exploited to plant malware on archive extraction
1ozss40,3,'Unremovable Israeli spyware' on your Samsung phone? Here's what the controversy is all about
1nblhpy,3,Doing nothing at work
1l8mpnx,0,"Kali GPT is the latest Linkedin fake trend bullshit, and here’s why!"
1p4nlaq,3,"Microsoft Ignite 2025 - Microsoft cares a lot about cybersecurity, not so much about cyber professionals"
1oj07ph,7,Exclusive: CEO of spyware maker Memento Labs confirms one of its government customers was caught using its malware
1k1bxj6,3,"Seeing more orgs move away from shipping company laptops to new hires. Instead, they’re letting people use personal machines to speed up onboarding and cut IT overhead. For anyone who's gone down this path, what security controls did you implement to make it work? What challenges come up?"
1it6k7q,2,CISA Adds Palo Alto Networks and SonicWall Flaws to Exploited Vulnerabilities List
1irkd81,2,A PostgreSQL zero-day was also exploited in US Treasury hack (CVE-2025-1094)
1oqp9qm,7,FBI subpoenas the web registrar behind Archive_is and its mirrors
1jg8tlw,3,"A bad workplace will destroy you, not make you stronger"
1l2byqc,2,Over 8M records with US patient medical data have been spilled online
1kpp1mv,0,I’m a Chief Information Security Officer (CISO). I also happen to be a woman. Ask me anything.
1jwmbpp,9,Senate hears Meta dangled US data in bid to enter China
1ix2eud,7,Recommended feeds to follow for staying aware with cyber news
1oo0y3p,0,"Australian police used a backdoored messaging app to gather evidence by distributing it within the criminal community, leading to 55 arrests"
1nukeiw,3,Yesterday I was using AI to persuade another AI to reveal secret API keys it shouldn't share. It worked really well. Today I learned why it was working thanks to a research paper from Wharton.
1r0iico,2,"Oracle gains 9%, Microsoft climbs 3% as tech tries to bounce back from $1 trillion sell-off"
1r0ida0,2,‘Godfather of AI’ shortens odds of the technology wiping out humanity over next 30 years | AI (artificial intelligence)
1r0fb61,1,BeyondTrust warns of critical RCE flaw in remote support software
1r0f8j6,2,US Air Force bans use of smart glasses among its troops — earphones and other Bluetooth devices also limited to official duties while in uniform
1r0dkev,0,Apple is killing the old HomeKit tomorrow
1r0djx0,6,Subaru Will Soon Have an Electric Three-Row SUV
1r0c9e5,0,Can AI Chatbots Write Emotionally Rich Romance Books?
1r0c7zw,0,Op-ed: Weakening Section 230 Would Chill Online Speech
1r0c7xz,9,California reserved $165 million for Tesla to electrify its trucking industry. The result may stifle EV innovation
1r0a6w7,5,"Scientists developed an AI model that can interpret and diagnose a brain MRI within seconds, with up to 97.5% accuracy and can predict the urgency of a patient's required treatment"
1r090u2,2,Alphabet Looks to Raise About $15 Billion From US Bond Sale (maturing in 2066) adding to a borrowing spree by companies at the forefront of the artificial intelligence investment boom.
1r08ztx,2,"Apple Prepares to Kick Off 2026 With the iPhone 17e, New iPads and Macs"
1r07mje,0,YouTube TV’s sports-focused package will cost $64.99 / month
1r07htj,0,Topological antenna could pave the way for 6G networks
1r07ffo,0,AI deepfake romance scam steals woman's home and life savings | How a fake celebrity video convinced a Southern California woman to sell everything
1r0781w,2,New tool blocks imposter attacks disguised as safe commands
1r067wn,2,Iran’s Digital Surveillance Machine Is Almost Complete
1r05txr,0,"California drivers whose licenses were recorded by parking garages may be owed $2,500"
1r05qjk,2,"Chinese technology underpins Iran’s internet control, report finds"
1r05exo,7,"Alphabet looks to raise about $15 billion from US bond sale, Bloomberg News reports"
1r0535a,6,Can China’s No. 2 automaker make it in America?
1r04pp4,7,Sam Altman touts ChatGPT's reaccelerating growth to employees as OpenAI closes in on $100 billion funding
1r03nz6,0,Electric Ferrari Luce's Interior Revealed: When Apple Meets Ferrari
1r027or,6,"Lucid's $50,000 EV Is Coming. It Doesn't Plan To Go Much Cheaper Than That"
1r026ed,7,Tesla executives say company is hiring to support Musk’s expanded solar strategy
1r025kt,2,Netflix’s Warner Bros. merger puts rival streamers in survival mode
1r0255h,2,Lyft debuts teen accounts more than two years after Uber
1r00foz,9,"SpaceX prioritizes lunar 'self-growing city' over Mars project, Musk says"
1qzzlaj,2,EU threatens Meta with interim measure for blocking AI rivals from WhatsApp
1qzx65p,0,Windows 11 ends legacy printer drivers in 2026
1qzvh29,2,"Microsoft purges Windows 11 printer drivers, putting millions of devices on borrowed time — legacy printers face extinction as Microsoft stops distributing V3 and V4 drivers"
1qzt3da,6,IBM CEO reveals when they’ll know if quantum computing is successful
1qzt27e,2,Crypto.com places $70M bet on AI.com domain ahead of Super Bowl
1qzss5x,2,Romanian rail workers accused of bribery turned to ChatGPT for legal tips
1qzsaq1,2,State-sponsored actor engaged in reconnaissance activity targeting government entities connecting to 155 countries in global-scale operations dubbed 'Shadow Campaigns' espionage op
1qzs04h,2,France murder trial complicated by twin brothers with same DNA
1qzriwp,2,Senate advances bill regulating 'Flock' license plate reader cameras
1qzprpk,7,US companies accused of ‘AI washing’ in citing artificial intelligence for job losses | US news
1qznurx,0,Wisconsin lawmakers explore age verification requirements on companionship chatbots
1qzntcj,2,"Reflections on Section 230’s Past, Present, and Future on Its 30th Anniversary"
1qzleri,0,"Lawmakers ask what it would take to ""store"" the International Space Station | NASA shall evaluate the “viability of transferring the ISS to a safe orbital harbor” after retirement."
1qzl0q4,2,Section 230 at 30: Internet's Legal Shield Faces Coordinated Repeal Push and Trial Threats
1qzkmn5,2,Florida lawmakers advance E-bike safety bill with 10 mph sidewalk speed limit
1qzibi8,2,Czech prime minister in favour of social media ban for under-15s
1qzhs1m,0,"As AI ‘very quickly’ blurs truth and fiction, experts warn of U.S. threat"
1qzhc0v,2,Thirty Candles for the Internet’s Foundation.
1qzg5u1,2,Uber ordered to pay $8.5m over claim driver raped passenger
1qz87a4,6,Analyst says Microsoft is 'getting owned' in AI race
1qz7rcz,1,"Vibe Coding Is Killing Open Source Software, Researchers Argue"
1qz6em6,2,Homeland Security Spying on Reddit Users
1qz4h22,0,Savannah Guthrie's demand for mom's 'proof of life' is complicated in this era of AI and deepfakes
1qz4fua,0,The Guthries' ransom demand is in Bitcoins for a reason
1qz3lzx,0,TikTok creators flock to UpScrolled app after U.S. takeover. Here's why
1qz3h7j,7,"Elon Musk shoots down starlink phone rumours, but hints at future AI device"
1qz31sa,3,I went back to Linux and it was a mistake
1qz2nhb,2,20-gigawatt Chinese microwave weapon touted as ‘Starlink’s worst nightmare’ by country's media — portable 5-ton device can deliver full-minute destructive bursts
1qz2lfj,0,The AI boom is so huge it’s causing shortages everywhere else
1qz2d63,7,Train Sim World devs announce Thomas the Tank Engine game 'powered by Train Sim World' and the true train sickos are down: 'It will make 9 trainzillion dollars'
1qz0lox,2,The kids ‘picked last in gym class’ gear up for Super Bowl
1qyvz95,2,China sends fourth ‘Shenlong’ reusable spacecraft mission into orbit
1qyvur0,6,Laid-off Big Tech workers are haunted by one question
1qyu4dm,2,Roblox's AI Age Verification Sparks Privacy Concerns Among UAE Parents
1qytpm8,0,DVDs and public transit: Boycott drives people to ditch Big Tech to protest ICE
1qytky0,0,US Supreme Court to decide if 1988 video tape privacy law applies to internet uses
1qys4i1,5,A new way to control light could boost future wireless tech | Feb 2026
1qyr981,0,Australia’s grid now relies on renewable energy as much as coal. Those who doubted it look foolish
1qyqlus,5,Breakthrough: Scientists Created a 'Universal' Kidney To Match Any Blood Type
1qyqf5l,0,"Steam is giving some players refunds for Ashes of Creation, which had the biggest MMO Kickstarter campaign ever, after leadership resignation and mass layoffs"
1qyowxu,5,Tesla Reveals New Roadster Logos in Trademark Filings
1qyodaa,0,These Mathematicians Are Putting A.I. to the Test
1qyn946,0,"Ad blocking is alive and well, despite Chrome's attempts to make it harder"
1qyn4p4,7,"State Department to purge pre-Trump X posts in ""one voice"" policy"
1qymaqn,0,Revealed: How Substack makes money from hosting Nazi newsletters
1qylvfc,0,Why a 175-Year-Old Glassmaker Is Suddenly an AI Superstar (WSJ Gift Article)
1qyj0cc,0,"Gran, 82, loses $200k retirement savings in AI deepfake doctor scam"
1qyj0un,0,The backlash over OpenAI's decision to retire GPT-4o shows how dangerous AI companions can be
1qyflac,7,Former Google X exec says AI threatens capitalism and CEO jobs
1qybl4o,0,Random or anonymous chat apps no longer welcome on the App Store
1qy2n8u,7,An AI startup founder says he’s planning a ‘March for Billionaires’ in protest of California’s wealth tax
1qydlnv,7,Anthropic buys Super Bowl ads to slap OpenAI for selling ads in ChatGPT
1qy3eih,3,"It Turns Out That When Waymos Are Stumped, They Get Intervention From Workers in the Philippines"
1ob20ei,0,"'This is definitely my last TwitchCon': High-profile streamer Emiru was assaulted at the event, even as streamers have been sounding the alarm about stalkers and harassment"
1n7ig5s,7,Trump Accused of Sharing Bogus Video of Deadly Drug Boat Strike | A Venezuelan official said the video the president gloated about was “generated by AI.”
1qh5kdg,7,US President Is Obsessed With Oil. But Chinese Batteries Will Soon Run the World.
1p5g3ld,0,"Booking.com cancelled woman's $4K hotel reservation, then offered her same rooms for $17K"
1n6u8ko,7,Trump calls video of bag being thrown from White House an ‘AI-generated’ fake
1k0j5v5,1,DOGE Goons Blamed for ‘Significant Cybersecurity Breach’
1j5zrim,3,"Dear Democrats: It Would Be Nice If You Could Lead, And Not Off A Cliff"
1n37iw0,3,Tesla said it didn’t have key data in a fatal crash. Then a hacker found it.
1jerikp,2,"Starlink Installed at White House to ""Improve Wi-Fi"" - Experts Question Security and Technical Necessity"
1kao2vb,2,U.S. Loses $60 Million Fighter Jet After It Slips Off Moving Aircraft Carrier | Pete Hegseth's headaches continue.
1jc2rov,2,“Glue delamination”: Tesla reportedly halting Cybertruck deliveries amid concerns of bodywork pieces flying off at speed
1nnyney,9,Disney reinstates Jimmy Kimmel after backlash over capitulation to FCC
1mn95cp,6,A massive Wyoming data center will soon use 5x more power than the state's human occupants - but no one knows who is using it
1pu2ae3,0,“Yo what?” LimeWire re-emerges in online rush to share pulled “60 Minutes” segment | Redditor jokes LimeWire is now a “champion against the darkness.”
1lz5yyl,9,Trump gets 'ratioed' on Truth Social for first time amid Epstein backlash
1p2vfdh,3,"Gmail can read your emails and attachments to train its AI, unless you opt out"
1jbh6v0,3,"US Attorney General Pam Bondi warns alleged vandals: “If you’re gonna touch a Tesla, go to a dealership, do anything, you better watch out because we’re coming after you.”"
1ma155z,2,The Internet Archive just became an official U.S. federal library via Sen. Alex Padilla
1j0xh7h,9,Trump administration retreats in fight against Russian cyber threats | US national security
1jl304u,2,"Pete Hegseth, Mike Waltz, Tulsi Gabbard: Private Data and Passwords of Senior U.S. Security Officials Found Online"
1ivkqn5,0,"US threatens to shut off Starlink if Ukraine won't sign minerals deal, sources tell Reuters"
1npb3p7,2,Pokémon Torches DHS Over ‘Gotta Catch ‘Em All’ ICE Raid Stunt
1oofbht,0,'Big Short' Michael Burry bets $1bn on AI bubble bursting
1jodgls,7,White House says it's 'case closed' on the Signal group chat review
1jlgqd3,2,"Trump calls Signal chat fallout a 'witch hunt,' says the messaging app 'could be defective'"
1o0bemo,0,Robin Williams’ daughter begs fans to stop sending her AI videos of late father
1nf9izc,2,Charlie Kirk’s alleged killer scratched bullets with a Helldivers combo and a furry sex meme. ﻿The suspected shooter left a hodgepodge of extremely online taunts.
1k40khq,2,"Pete Hegseth reportedly spilled Yemen attack details in another Signal chat | He used his personal phone for the other chat, which once included his wife and “about a dozen” other people."
1lhv29v,2,Iranian-Aligned Hackers Claim Responsibility for Attack on Trump’s Truth Social Platform
1j3pws0,2,Democrat questions Marco Rubio over reported State Department Tesla purchase
1n1sfot,0,"With US taking a 10% stake, Intel warns investors to brace for losses and uncertainties -- ""It sets a bad precedent if the president can just take 10 percent of a company by threatening the CEO"""
1iuwr6x,2,FBI Says Backup Now—Confirms Dangerous Attacks Underway
1j443qe,7,59% of Republicans Believe the Media Is 'Fake News'
1jeeko3,2,"Teslas Torched at Las Vegas Facility in ""Targeted Attack"" - Authorities say the suspect damaged five cars with Molotov cocktails and a firearm and spray-painted ""Resist"" on the front of the building"
1oh13rv,5,"COVID-19 mRNA vaccines can trigger the immune system to recognize and kill cancer, research finds"
1lgm7yi,7,"Zuckerberg’s political shift didn’t shock Meta staff - ""One inch underneath, this was all there"""
1qrof0l,7,"ICE protester Nicole Cleland, a 56-year-old resident of Richfield and a director at Target Corporation, says her Global Entry was revoked after agent scanned her face | Global Entry and Precheck revoked three days after incident, court filing says."
1ovmgxd,2,Deaf Tesla employee fired after complaining that ‘extreme heat’ in Gigafactory made hearing aids malfunction
1not7ba,0,FCC chairman unconvincingly claims he never threatened ABC station licenses | Brendan Carr would like you to reject the evidence of your eyes and ears.
1pcaqvf,6,IBM CEO says there is 'no way' spending trillions on AI data centers will pay off at today's infrastructure costs
1o1jo0z,2,Apple Quietly Made ICE Agents a Protected Class: Internal emails show tech giant used anti-hate-speech rules meant for minorities to block an app documenting immigration enforcement.
1kfermy,7,"Goodbye to the old Facebook - Zuckerberg admits he no longer connects family and friends, faces FTC lawsuit that could dismantle Meta"
1ln6ctn,7,Big Brother Trump Is Watching You: The second Trump administration is deploying new surveillance methods it seeks to extend its authoritarian power.
1qkwbw4,2,"Tesla kills Autopilot, locks lane-keeping behind $99/month fee."
1izsyqa,2,The Trump Admin Thinks Affordable Fiber Broadband Is ‘Woke’
1j9ljqr,5,Trump's efforts to help Tesla could hurt it instead
1qted9b,0,"32-year-old programmer in China allegedly dies from overwork, added to work group chat even while in hospital"
1nzz9e9,2,"Ted Cruz picks a fight with Wikipedia, accusing platform of left-wing bias"
1mniom8,7,Reddit will block the Internet Archive
1ksp81y,2,"Trump admin tells Supreme Court: DOGE needs to do its work in secret | DOJ complains of ""sweeping, intrusive discovery"" after DOGE refused FOIA requests."
1kz2139,7,RFK Jr.‘s ‘Make America Healthy Again’ report seems riddled with AI slop
1o33luu,3,"Sean Duffy Threatens to Fire Air Traffic Controllers as 10% Call Out Sick During Shutdown | ""When you come to work, you get paid. If you don't come to work, you don't get paid."""
1q661vq,2,"President White House Launches New Website to Defend 'Patriotic Americans' Involved in Jan. 6 Capitol Riot | The White House claims the Democrats ""staged the real insurrection"" by certifying former President Joe Biden's victory in the 2020 presidential election"
1jpwbqf,2,Trump kicks off sale of $2.3bn Truth Social stake
1njsge7,7,"Disney's ABC pulls 'Jimmy Kimmel Live!' after FCC chair criticizes the host's comments | The network confirmed to NBC News it is ""indefinitely"" pulling the show."
1l1dod9,0,Today is the day New Jersey starts the break up process with Tesla on the Turnpike. All 64 Tesla Superchargers to be decommissioned and replaced with universal EV chargers; becoming available June 6th at all but three service areas. The remaining three by the end of fall
1poim26,6,"Mozilla says Firefox will evolve into an AI browser, and nobody is happy about it — ""I've never seen a company so astoundingly out of touch"""
1og6r77,2,"Ludicrous $6 billion Counter Strike 2 skins market crashes, loses $3 billion overnight — game update destroys inventories, collapses market"
1jlzcc0,2,"Car prices could jump $6,000 as Trump's 25% import tariff kicks in | Brace for higher car prices"
1o0e0zc,2,"Taylor Swift loses over 1,000,000 Instagram followers after The Life of a Showgirl release as fans slam use of AI in album promotion"
1lafiif,0,'We're done with Teams': German state hits uninstall on Microsoft
1oacnub,0,"Judge tells Homeland Security that Chicago agents wearing body cameras was ""not a suggestion"""
1lduwwc,2,"Google is intentionally throttling YouTube videos, slowing down users with ad blockers"
1k2c5zf,2,Trump Turns Covid.gov Into a Lab Leak Theory Fan Page | The president will never take responsibility for his failures in 2020.
1jwph4e,0,"Trump's tariffs force laptop makers like Dell and Lenovo to halt US shipments | The supply chain is in shambles, and technology companies are trying to adapt"
1jhbito,0,"Tesla reportedly missing $1.4 billion, but we're sure it's fine — “Aggressive classification of operating expenses as investment can be used to artificially boost reported profits”: FT"
1lbbjmp,0,"'No Kings’ Protests, Citizen-Run ICE Trackers Trigger Intelligence Warnings"
1lrsrl0,0,Tesla’s Cybertruck flop is historic. The brand collapse is even worse
1o4t6o2,7,"The AI bubble is 17 times the size of the dot-com frenzy — and four times the subprime bubble, analyst says"
1ioj06i,0,Serial “swatter” behind 375 violent hoaxes targeted his own home to look like a victim
1nhn3n1,7,California says it can no longer trust Washington on COVID vaccines. A major battle is looming
1kwuja2,2,The sun is killing off SpaceX's Starlink satellites
1j943j2,0,"Tech Execs Are Pushing Trump to Build ‘Freedom Cities’ Run by Corporations | A pro-corporate libertarian movement is attempting to take over the U.S., with Trump's help."
1jxmb6t,3,Republican Mike Johnson Says Men Need to Stop 'Playing Video Games All Day' and Get to Work: 'They're Draining Resources'
1lppwpz,2,ICEBlock climbs to the top of the App Store charts after officials slam it
1isour2,2,DOGE Reportedly Cuts FDA Employees Investigating Neuralink
1ozy4zi,2,"President admin axed 383 active clinical trials, dumping over 74K participants | It’s a “violation of foundational ethical principles of human participant research.”"
1izkyts,2,"Starlink poised to takeover $2.4 billion contract to overhaul air traffic control communication | The contract had already been awarded to Verizon, but now a SpaceX-led team within the FAA is reportedly recommending it go to Starlink."
1qv9kcb,0,DHS Hunts Down 67-Year-Old U.S. Citizen Who Criticized Them in Email
1nram0p,5,"Cracker Barrel Outrage Was Almost Certainly Driven by Bots, Researchers Say"
1m5xqqe,2,"YouTube wipes out thousands of propaganda channels linked to China, Russia, others"
1p544mf,1,"Many prominent Maga personalities on X are based outside US, new tool reveals"
