post_id,cluster_id,text
1iqy8te,7,"Hinton: ""I thought JD Vance's statement was ludicrous nonsense conveying a total lack of understanding of the dangers of AI ... this alliance between AI companies and the US government is very scary because this administration has no concern for AI safety."""
1pdb7ml,7,Microsoft's reported sales struggles are a warning that huge AI spending might take a while to pay off
1izfhw7,6,DeepSeek just made it even cheaper for developers to use its AI model
1nbntx4,0,'Godfather of AI' says the technology will create massive unemployment and send profits soaring — 'that is the capitalist system'
1k5ujt0,7,OpenAI wants to buy Chrome and make it an “AI-first” experience
1jnfau0,0,"Don’t water down Europe’s AI rules to please Trump, EU lawmakers warn"
1l5a3ka,0,Inside the Secret Meeting Where Mathematicians Struggled to Outsmart AI (Scientific American)
1plx3ah,6,"Fei-Fei Li, a Stanford professor and CEO of AI startup World Labs, known as the 'Godmother of AI' says degrees are less important in hiring than how quickly you can ‘superpower yourself’ with new tools"
1nzr23s,7,'It's a talent tax': AI CEOs fear demise as they accuse Trump of launching 'labor war'
1klptkn,2,Congress floats banning states from regulating AI in any way for 10 years
1oci6nu,7,The war between bosses and employees over AI is getting ugly
1jz0ewg,6,"Nvidia finally has some AI competition as Huawei shows off data center supercomputer that is better ""on all metrics"""
1pkuaaq,0,An AI agent spent 16 hours hacking Stanford's network. It outperformed human pros for much less than their 6-figure salaries.
1jbux8x,0,Gemini 2.0 Flash is incredible
1lmgkil,7,Grok turned on Elon with almost no prompting. Uncanny is the only word I have
1lg4tvy,0,4 AI agents planned an event and 23 humans showed up
1jx085q,0,The final boss of CUDA Kernels.
1ou91ok,2,Meta chief AI scientist Yann LeCun plans to exit to launch startup
1kasonh,5,Reddit bans researchers who used AI bots to manipulate commenters | Reddit’s lawyer called the University of Zurich researchers’ project an ‘improper and highly unethical experiment.’
1nburdo,4,Does this meme about AI use at IKEA customer service make sense?
1kjzo8z,7,"Proof Google AI Is Sourcing ""Citations"" From Random Reddit Posts"
1jujx40,7,"Exclusive: Musk's DOGE using AI to snoop on U.S. federal workers, sources say"
1mc8211,0,Nobel Prize winner Geoffrey Hinton explains why smarter-than-human AI could wipe us out.
1ntk5kg,6,Walmart CEO wants 'everybody to make it to the other side' and the retail giant will keep headcount flat for now even as AI changes every job | Fortune
1pwzlpl,2,"China activates a nationwide distributed AI computing network connecting data centers over 2,000 km"
1mllcn7,2,AI industry horrified to face largest copyright class action ever certified (up to 7 million claimants) | Ars Technica
1ku92ez,4,Which app or service does that?
1kfjr1v,2,OpenAI abandons plan to be controlled by for-profit board
1p85s5y,0,Mexico to build Latin America's most powerful 314-petaflop supercomputer
1ol5r4u,4,"Companies are trying to do too much with AI, says IT CEO | Fortune"
1jahbm4,9,"OpenAI calls DeepSeek 'state-controlled,' calls for bans on 'PRC-produced' models"
1j2ytq5,5,Using ChatGPT's new Deep Research feature
1oufdc3,3,It's been a big week for AI ; Here are 10 massive developments you might've missed:
1o6ck4l,3,"Anthropic cofounder admits he is now ""deeply afraid"" ... ""We are dealing with a real and mysterious creature, not a simple and predictable machine ... We need the courage to see things as they are."""
1m0o0kn,7,"Grok will no longer call itself Hitler or base its opinions on Elon Musk’s, promises xAI"
1lnhn34,1,"Ilya Sutskever says future superintelligent data centers are a new form of ""non-human life"". He's working on superalignment: ""We want those data centers to hold warm and positive feelings towards people, towards humanity."""
1pec5an,4,This guy built an AI for your ear that you talk to and it literally changes what you hear
1lwbvje,7,AI is now writing 50% of the code at Google
1l2gyrr,3,"Dario Amodei worries that due to AI job losses, ordinary people will lose their economic leverage, which breaks democracy and leads to severe concentration of power: ""We need to be raising the alarms. We can prevent it, but not by just saying 'everything's gonna be OK'."""
1irm1wx,7,Nvidia compute is doubling every 10 months
1lxw0wp,3,"Turns out, aligning LLMs to be ""helpful"" via human feedback actually teaches them to bullshit."
1iwjxvb,7,"Researchers Find Elon Musk's New Grok AI Is Extremely Vulnerable to Hacking - ""Seems like all these new models are racing for speed over security, and it shows."""
1ps61q5,0,Half of Steam's Current Top 10 Best-Selling Games Are From Devs Who Embraced Gen AI
1ks4c40,3,"EU President: ""We thought AI would only approach human reasoning around 2050. Now we expect this to happen already next year."""
1j41dln,7,"Nvidia CEO Jensen Huang praises DeepSeek for ""fantastic"" and ""world class"" open-source reasoning model"
1p3d1xu,3,Nvidia CEO says AI will actually make everyone a lot busier: 'Everybody's jobs will be different' | Fortune
1iokrx9,0,There are only 7 American competitive coders rated higher than o3
1lrieza,2,"After Microsoft laid off 9000 employees, Xbox producer Matt Turnbull suggested affected workers use AI to “reduce the emotional and cognitive load that comes with job loss”"
1kz6yg5,3,"CEOs know AI will shrink their teams — they're just too afraid to say it, say 2 software investors"
1jlvylx,3,"""Generate a comic about your life as chatgpt"" 2"
1je9tjh,0,Unitree robots marching down the street
1kdw4b7,2,"MIT's Max Tegmark: ""My assessment is that the 'Compton constant', the probability that a race to AGI culminates in loss of control of Earth, is &gt;90%."""
1mfw5fj,7,FDA's New Drug Approval AI Is Generating Fake Studies: Report
1nnu0s6,2,"Trump’s $100,000 H-1B fee rattles Silicon Valley and threatens AI startups | Fortune"
1mnsz96,7,Palantir CEO warns of America’s AI ‘danger zone’ as he plans to bring ‘superpowers’ to blue-collar workers
1ks3egn,7,OpenAI is buying Jony Ive’s AI hardware company | The deal is valued at nearly $6.5 billion.
1o85knq,9,Google DeepMind’s new AI helps find potential breakthrough in cancer treatment
1nmb2k7,6,ChatGPT Is Blowing Up Marriages as Spouses Use AI to Attack Their Partners
1njw7bt,7,Russian State TV Launches AI-Generated News Satire Show. An AI-generated show on Russian TV includes Trump singing obnoxious songs and talking about golden toilets.
1p7c303,5,MIT study finds AI can already replace 11.7% of U.S. workforce
1p1691n,2,Larry Summers resigns from OpenAI board amid Epstein revelations
1n7q114,0,Men are opening up about mental health to AI instead of humans
1lls7ty,2,Denmark to tackle deepfakes by giving people copyright to their own features
1jla4rw,3,What is my purpose? To make Ghibli images
1nvduc2,8,Fun Interview with Jason Strimpel about transferable skills from data science to algorithmic trading.
1nv0lfh,8,"For data scientists in insurance and banking, how many data scientists/ML engineers work in your company, how are their teams organised, and roughly what do they work on?"
1nurg0y,0,Distance Correlation &amp; Matrix Association. Good stuff?
1nucvgd,2,Weekend Project - Poker Agents Video/Code
1ntlgy5,1,Career advice
1nt8wl0,1,What a Drunk Man Can Teach Us About Time Series Forecasting
1nt8d65,2,"Weekly Entering &amp; Transitioning - Thread 29 Sep, 2025 - 06 Oct, 2025"
1nt6q59,4,What interesting projects are you working on that are not related to AI?
1nsxpad,2,"Oscillatory Coordination in Cognitive Architectures: Old Dog, New Math"
1nso6sy,0,Relationship between ROC AUC and Gain curve?
1ns18vu,1,Seeking Feedback on My Data Science CV
1nrla6h,1,Week Bites: Weekly Dose of Data Science
1nqwcip,8,What is the state-of-the-art prediction performance for the stock market?
1nq8hi5,3,I'm still not sure how to answer vague DS questions...
1nq1bj4,0,Introducing ryxpress: Reproducible Polyglot Analytical Pipelines with Nix (Python)
1nphgwl,1,Expectations for probability questions in interviews
1npfecr,3,Ad-hoc questions are the real killer. Curious if others feel this pain
1no5b1j,0,Is a second masters worth it for MLE roles?
1nnsvq3,5,New RAG Builder: Create a SOTA RAG system in under 5 minutes. Which models/methods should we add next? [Kiln]
1nnfcwc,6,Is it due to the tech recession?
1nnck8a,2,"Weekly Entering &amp; Transitioning - Thread 22 Sep, 2025 - 29 Sep, 2025"
1nncgka,1,Need input from mid-career dara Scientists (2-5 year range)
1nlldi9,0,Transformer with multi-dimensional timesteps
1nl92og,1,Updated based on subreddit feedback. Applying for mid-senior based roles. Thank you
1nl4oi1,0,How to actually perform observational studies in industry?
1nl4jtx,3,What’s the right thing to say to salary expectations question?
1njp4vy,2,K-shot training with LLMs for document annotation/extraction
1njcvfv,1,Example Take Home Assignment For Interview - Data Science in Finance
1nj9mu5,1,Privacy-Safe Tabular Synthetic Data with TabPFN
1nj55qy,0,How do you conduct a power analysis on a causal observational study?
1nioq77,3,Python Projects For Beginners to Advanced | Build Logic | Build Apps | Intro on Generative AI|Gemini
1niop8o,0,Python Projects For Beginners to Advanced | Build Logic | Build Apps | Intro on Generative AI|Gemini
1nhzoam,0,Advice on presenting yourself
1nhy9qb,1,Free LLM API Providers
1nhskvc,3,How do you factor seasonality in A/B test experiments? Which methods you personally use and why?
1nhoblg,0,"Is an explicit ""treatment"" variable a necessary condition for instrumental variable analysis?"
1nhbvwg,2,"Weekly Entering &amp; Transitioning - Thread 15 Sep, 2025 - 22 Sep, 2025"
1ngj3v5,1,Has anyone validated synthetic financial data (Gaussian Copula vs CTGAN) in practice?
1ng5x61,0,Texts for creating better visualizations/presentations?
1ng1xk3,8,The “three tiers” of data engineering pay — and how to move up
1nfzxy9,1,Database tools and method for tree structured data?
1nenrg8,0,An introduction to program synthesis
1neack3,1,Transitioning to MLE/MLOps from DS
1ne37bs,9,Looking for recent research on explainable AI (XAI)
1nd94cy,9,(: Smile! It’s my first open source project
1nc93qq,0,I built a card recommender for EDH decks
1nbxzs0,0,Analysing Priority zones in my Area with unprecise home adresses
1nbdtct,2,"Weekly Entering &amp; Transitioning - Thread 08 Sep, 2025 - 15 Sep, 2025"
1naptuq,0,🚀 Perpetual ML Suite: Now Live on the Snowflake Marketplace!
1nac35j,1,How to evaluate data transformations?
1na6x3q,3,Help me evaluate a new job offer - Stay or go?
1n83iok,4,Would you volunteer to join the team building AI tooling? If you have what has been your experience?
1n81hrr,3,How are you liking Positron?
1n7zgzy,3,"Per row context understanding is hard for SQL and RAG databases, here's how we solved it with LLMs"
1n7ops6,0,Freelance search
1n70y9a,0,Diffusion models
1n6ez8o,3,Is it wrong to be specialized in specific DS niche?
1n6cug7,0,The Hidden Costs of Naive Retrieval
1n5eqdj,2,"Weekly Entering &amp; Transitioning - Thread 01 Sep, 2025 - 08 Sep, 2025"
1n4rufc,3,Let’s Build Something Together
1n4bamu,8,Advice for DS/AS/MLE interviews
1n3jnpw,3,How do you design a test to compare two audience targeting methods?
1n2o7c1,2,"Free 1,000 CPU + 100 GPU hours for testers"
1n28ukj,3,I built Runcell - an AI agent for Jupyter that actually understands your notebook context
1n1zo5y,0,Why is Typescript starting to gain adoption in AI?
1n0ep0g,4,How do I make the most of this opportunity
1mzxmx3,0,Looking to transition to experimentation
1mzwdws,2,"""The Vibes are Off..."" *server logs filling with errors*"
1mzlzsp,1,"First time writing a technical article, would love constructive feedback"
1mzgkc7,2,"Weekly Entering &amp; Transitioning - Thread 25 Aug, 2025 - 01 Sep, 2025"
1mz2jgn,8,Day to day work at lead/principal data scientist
1mxyprj,8,Anyone Using Search APIs as a Data Source?
1mxpyef,4,When do we really need an Agent instead of just ChatGPT?
1mxhji7,0,"DS/DA Recruiters, do you approve of my plan"
1mwchp8,0,[Hiring] MLE Position - Enterprise-Grade LLM Solutions
1jr680q,8,Getting back to Data Science after 4 years out
1jpq0x1,1,Tensorflow/Keras vs PyTorch for industry?
1jf8uwm,3,How exactly people are getting contacted by recruiters on LinkedIn?
1irs5de,4,What app making framework do you recommend to data scientists?
1lvmphl,8,"All of my data comes from spreadsheets. As I receive more over time, what’s the best way to manage and access multiple files efficiently? Ideally in a way that scales and still lets me work interactively with the data?"
1le3whp,4,How would you categorize this DS skill?
1kydj2t,1,I turned a real machine learning project into a children's book
1jb0i8y,4,How much of the ML pipeline am I expected to know as DS?
1itn1zg,3,How do you organize your files?
1l8gmy0,1,Lyft vs Pinterest Data Science
1kyesak,3,Did any certifications or courses actually make a difference or were great investments financially?
1m10uku,4,What question from recruiters do you absolutely hate to answer? How do you answer it elegantly?
1lcpzzw,4,"""Yes, I do want to allow this app to make changes to my device!"""
1kgzki4,0,Is HackerRank/LeetCode a valid way to screen candidates?
1iq9hcp,4,What is your daily/weekly routine if you have a WFH position?
1k0zcye,8,Data Engineer trying to understand data science to provide better support.
1mgfcke,8,Built this out of pure laziness for all my Feature engineering/model training jobs
1m3gy6m,3,Are headhunters still a thing in 2025?
1l1nm9m,3,How do you teach business common sense?
1lu7gqq,3,How to deal with time series unbalanced situations?
1lntegl,4,ICs who pivoted: did you go engineering or management?
1k2ax74,4,What does a good DS manager look like to you? How does one manage a DS project?
1k2y84g,1,Data science content gap
1jeg1xn,1,Setting Expectations with Management &amp; Growing as a Professional
1iwemoj,1,Gym chain data scientists?
1lyo2ac,1,Toto: A Foundation Time-Series Model Optimized for Observability Data
1lgvh62,0,ML case study rounds
1lgfmli,1,Toolkit to move from junior to senior data analyst (data science track)
1k0v0dc,3,"Does anyone here work for DoorDash, Discover, Home Depot, or Liberty Mutual?"
1mf44ek,1,Using a hybrid role in job title (Data Science and Engineer)
1lq4xgr,3,How much wiggle room do you give yourself on DS projects?
1ll7or7,3,"When applying internally, do you reach out to the hiring manager?"
1kjqlcv,2,New Python Package Feedback - Try in Google Collab
1j03efx,0,Fwd - NAME &amp; SHAME: PACIFIC LIFE INSURANCE - sharing cuz reading this pissed me off. Similar experience with them last year.
1k63zii,3,"To Interviewers who ask product metrics cases study, what makes you say yes or no to a candidate, do you want complex metrics? Or basic works too?"
1j1crux,0,Any examples of GenAI in the value chain?
1ir26jt,1,Starting a Data Consultancy
1kyr1va,0,Regularization=magic?
1mmzk4s,1,"Catch-22: Learning R through ""hands on"" Projects"
1krau6q,8,Are there any math tests that test mathematical skill for data science?
1jti77o,3,I created a basic playground to help people familiarise themselves with copulas
1lq0v8p,1,I am currently a data scientist. How can I move to a more business oriented rule?
1l5tiqg,3,What is your domain and what are the most important technical skills that help you stand out in your domain?
1l8kf9h,3,I have a training budget of ~250 USD for my own professional development. What would you recommend I spend it on?
1k81pru,4,An example of how statistics can be used to unintentionally deceive (and why data analysis is important).
1mtehzk,3,Curious to know about people who switched from DS to DE or SWE or Solutions Architect
1ljiuzx,2,A Breakdown of RAG vs CAG
1l1uzi1,8,How do I manage expectations for my career as a prospective data scientist
1jdotmw,8,What is financial fraud prevention data science like as a career path?
1iy5rks,0,Shitty debugging job taught me the most
1jo82j8,3,Struggling to understand A/B Test
1njb8pi,0,Determination of the fifth Busy Beaver value
1ngtwjg,1,Having trouble understanding CPU architecture!
1ngieqn,3,"Anybody have any books/PDFS, videos, or course info for a self learner who is interested in computer arithmetic and how code is written and hardware is manipulated when doing arithmetic? Thanks!"
1nfywyx,1,"Introduction books on AST, parsers och formal languages?"
1nekkmg,0,how limited is computation in being useful for the human experience?
1ndpg6d,3,Struggling with Algorithms &amp; Databases — What Resources Helped You Understand?
1naukcj,1,Any app to practice discrete math?
1napvy3,8,Tell me resources for distributed computing?
1n9mnp7,3,Need this confusion to resolve
1n9ca2d,4,Why is there two place for A1 and A0 and how do I use this multiplicater ?
1n7zxhg,0,What's your recommendation?
1n70qez,0,Temporal logic x lambda calculus
1n5d02l,3,my idea for variable length float (not sure if this has been discovered before)
1n4ymum,8,eBPF 101: Your First Step into Kernel Programming
1n423ji,2,Time-bounded SAT fixed-point with explicit Cook-Levin accounting
1n40sx7,8,How much can quantum computer helps in auto-parallelism of programs in compiler?
1n0hfs8,3,"[D] An honest attempt to implement ""Attention is all you need"" paper"
1n0658c,3,what should i be learnt to start learning programming languages?
1mz135c,0,Single level stores and context switching
1myc2qt,0,JesseSort2: Electric Boogaloo
1mxek13,1,Math Required for understanding Algorithms and Programming and Entire CS engineering
1mxbfzl,9,I made an AI Chatbot inside a Kids' Game Engine that Runs on a Pi Zero
1mx6t90,0,When Would You Want Both Active:Active and Active:Passive Failover?
1mx3v8l,1,Bridging Backend and Data Engineering: Communicating Through Events
1mwzfny,4,Is it true that computer science graduates can do anything that software engineers learn
1mwyhel,0,"Guíe MHD simulation, astrophysics"
1mw3huf,0,Is it possible to create an application that creates fake datas to make cookies useless?
1mu6knb,0,Neuromorphic architecture?
1mte25z,2,Breaking the Sorting Barrier for Directed Single-Source Shortest Paths
1mtcgn2,0,Deferred Representation
1mt3gll,3,Why are vulnerabilities from CVE's kept in secrecy while rootkits are in the wild
1mqtbsz,0,Branch prediction: Why CPUs can't wait? - namvdo's blog
1mqlime,0,Interesting applications of digital signatures?
1mpgxqk,0,Is there a formal treatment of design patterns?
1mojlfq,2,Fixing CLI Error Handling: A Deep Dive into Keyshade's WebSocket Communication Bug
1mo86fz,0,Good resources that teach concurrency for beginners ?
1mo4hsr,3,We have three levels of access... what about a fourth?
1mo4chr,3,Resources to learn DBMS
1mmc5nj,8,Increased python performance for data science!
1mlqvu3,1,Seeking Comprehensive Resources for Understanding Social Media Algorithms
1ml50k5,8,"Looking for a good book on software engineering, design, and/or architecture. Preferably for C++ or TypeScript."
1mkwcc6,3,Does work experience help in PhD applications?
1mklmrb,1,Self teaching Computer Networking Flop
1mk2pft,8,What internal data structure does a .bib file in BibTex use?
1mjbyz5,0,Analog programming of a digital device (Van Eck Phreaking)
1mihuil,1,Compiled vs interpreted language and security concerns
1mho892,3,Is it tough to publish a research paper in CS by myself alone? How do I go about it?
1mhliz8,2,Report highlights New York's gap in computing education
1mgd4r5,0,A new way to edit or generate images
1mgcug8,8,What is a computer?
1mfvvlx,0,A Brief Look at the Mathematics of Structure Packing
1mfts82,3,Is there a theory around reverse computing ?
1mfoiqp,2,Dead Internet Solution- a Tree Inspired Social Network
1mf5ucv,3,"Question about the usefulness of a ""superposition"" datatype."
1met9x7,1,Viable programming languages for combinatorial optimization research
1mdrzse,8,Seeking advice on the best way to learn hardware and software interaction.
1jy8t8g,8,relating all concepts you learn from different streams of science
1j7dcam,3,How to learn gpu architecture?
1j3upnk,2,Google maps / Uber Routing alogrithm
1iq9kh5,0,Variations of Von Neumann Architecture
1k8imyd,1,Transition to system programming and distributed systems
1jy0nay,1,Any application of Signals and Systems?
1md6c6n,0,Quantum computing only concerns about brute forcing a password?
1k93ewk,8,Computer Science book that will lead to insights into various Computer Systems?
1k3vp73,3,Byzantine Fault Tolerance: How Computers Trust Each Other When They Shouldn't
1jxpua9,0,A Computational Graph builder for circuit evaluation and constraint checking
1lc6uyp,1,What is the theory behind representing different data structures using arbitrary length integers?
1ktfi35,3,C or C++ or some other lang
1jlnno8,4,How do I make programs that are more friendly to the system in terms of performance? Is it worth even trying?
1j0z1i1,0,Build a simple distributed text-editor with position-based CRDTs
1iyka7m,0,Understanding Automatic Differentiation and Dual Numbers
1iq6768,0,Convirgance - Alternative to ORMs (AMA)
1ion2gm,1,"What RFCs are your favourite, based on enjoyable reading?"
1kyh2oo,0,"Will quantum computers ever be available to everyday consumers, or will the always be exclusively used by companies, governments, and researchers?"
1kvsyex,1,Resource on low level math optimisation
1kjffzv,0,Flip Flops and Stochastic Processes
1khtocr,3,"I've been watching a video explaining the simplex method for linear programming. I got to this screen, and I have a question"
1lvi3zu,8,What should I study on my own?
1kq0276,0,Built simple http server in c
1jxopcz,0,Why electrons flow from the N-semiconductor to a P-semiconductor?
1l43dyz,3,What situation in the area of Networks would require you to use Bellman Fords algorithm instead of Djikstra’s because there are negative edge weights?
1kb3bea,3,Is Linear Probing Really that Bad of a Solution for Open-Addressing?
1jwujre,1,Best data structure for representing a partially ordered set (POSET) or lattices
1jfh8pj,0,funny thought
1m9aiq1,3,"If P = NP, dose this mean NP != EXP ?"
1lvz8o9,3,"Is there any name for a situation like this, where we can't make computers more advanced"
1lkrxuo,0,Deterministic Finite Automata
1l37ofe,1,Computer History
1kzanmy,1,Guidance for continue learning Computer Architecture
1kl22sy,0,Basic question about parallel repetition in IP protocol
1kgw29z,4,How to carry over DSA Skills from one language to another?
1j7zsvc,0,Circuit Compiler
1izle43,1,Resource Learning Advice: Hardware
1m94bxj,8,Resources for learning the computer architecture deeply
1lyd3gu,3,"Realistically speaking, if you were to pursue a PHD, what topics can you even research anymore?"
1lgqdug,0,"Tips on self-studying from textbooks, and how the heck can I verify my solutions?"
1m3r2aq,5,"""World's most power dense"" electric motor obliterates the field | YASA takes the next step in its modernization and development of axial-flux technology, demonstrating a huge new benchmark"
1m26y8d,0,Back-bending robodog climbs tight spaces faster
1m25pfb,0,Robot metabolism: Toward machines that can grow by consuming other machines
1m23qo8,5,Anti-nausea drug lowers risk of death from aggressive breast cancer by 39% | An anti-nausea drug used to combat the side effects of chemo can improve breast cancer outcomes
1m1bb9h,5,Scientists develop blood test that reveals how fast your organs are aging | The scientists found that an organ's biological age strongly predicts the risk of related diseases
1m0wtqw,2,"Alibaba-backed Moonshot releases new Kimi AI model that beats ChatGPT, Claude in coding — and it costs less"
1m0hmu0,2,A prosthesis driven by the nervous system helps people with amputation walk naturally
1m0ezti,3,"Spy-grade storage drive self-destructs on demand just like in the movies | This industrial storage drive for computers and servers can physically destroy itself at the push of a button, so your secrets go up in smoke before they fall into the wrong hands."
1m04b5c,2,SpaceX rocket to launch Amazon broadband satellites from Cape Canaveral Space Force Station
1lzsaog,2,Holographic ribbon challenges magnetic tape with 50-year longevity and 200TB cartridges | British startup unveils holographic tape that promises 50-year data lifespan
1lzm0iq,0,DARPA greenlights Bell's rotor-folding X-plane
1lzizlo,2,DARPA Sets New Record for Wireless Power Beaming | The latest effort beamed 800 watts over 8.6 kilometers
1lysu4t,5,A bionic knee integrated into tissue can restore natural movement
1lyrkbi,0,"Laser tool cleans vintage aircraft in days, not months with much less hazard to health."
1lxxzp8,5,Tiny lab-in-a-pill can monitor your gut health from the inside | This wireless pill that tracks your digestive system in real time could revolutionize gut health monitoring
1lwchok,0,Ancient-fossil bioconcrete traps 142% more carbon – and it’s strong as hell
1lwa1b2,0,"MIT's smart implant dispenses life-saving drug when diabetics need it most | A glucagon implant features a drug reservoir sealed with an alloy that changes shape when heated, so it can dispense its contents on demand"
1lvjx00,5,"Scientists 3D print tumors for cancer research — TissueTinker using 3D bioprinting to create miniature models of healthy and diseased tissue for side-by-side comparison, backed by McGill"
1lvism8,5,Next-Gen Brain Implants Offer New Hope for Depression
1lvid6v,5,Autonomous MIT robot helps discover better materials for solar panels
1lvi6hi,2,Battery Materials Produced From Common Rock | Aspiring Materials is turning olivine into several useful materials
1lvf9y4,5,"Chinese researchers unveil MemOS, the first 'memory operating system' that gives AI human-like recall"
1lun74a,5,75% of stomach cancer cases could be prevented with a simple treatment
