post_id,cluster_id,text
1pznjuc,3,Would it theoretically be possible to make a memory leak happen on purpose? I know memory leaks only happen under pretty specific conditions but I've always been oddly fascinated by the useless side of modern technology.
1oefrkk,3,How does the internet work?
1mh93pu,8,"What CS topics should every software engineer learn, even if they don’t seem useful at first?"
1p386bm,0,"Realizing that the ""right"" algorithm matters way more than hardware speed was a massive wake-up call for me."
1jkir4v,8,What are some papers/ thesus/ books every programmer should read
1ksd8sc,0,Why Are Recursive Functions Used?
1ow8gfy,1,ACM is making their digital library open access!
1n3g32d,4,How big would an iphone that was built using vacuum tubes be?
1paif63,4,Isn't teaching kids an Assembly like language actually a good idea?
1irmz7k,8,Where can my son get feedback on his coding projects?
1lf0oqf,2,"Saved Alan Turing papers sold at auction in Etwall for £465,400"
1jfv1tk,5,New prime algorithm I just made
1l8gu8j,2,The Beauty of Data Conversion.
1knwhiu,4,"Machine learning used to be cool, no?"
1n4tw6p,1,Randomness in theoretical CS
1mzz19o,3,How many bits does a song really have? Or am I asking the wrong question?
1jtgdi7,0,How important is Linear Algebra?
1mhzs5q,4,"How does the computer know now to prompt saving a document when I type something, erase it and type it back?"
1pyftqj,3,How casio calculator compute derivative of a function?
1okzs3l,3,What exactly are classes under the hood?
1iojekx,8,How can I turn my brain into an engineer's brain?
1kye7k5,3,How much CS do I need to be familiar with to learn theoretical computer science?
1pd57e5,5,Bacteria used to make and dye fiber for clothing in the same vat
1pbe7h2,5,Tuneable perovskite: A breakthrough in low-cost solar and laser materials
1pajpr5,9,Stretchy battery inspired by lemons improves voltage and cell life
1p83tf1,2,Simple solvent makes polycotton fabric completely recyclable
1p78c7n,0,"3D-printable concrete alternative hardens in three days, not four weeks"
1p6cm0a,5,A newly discovered 'pain switch' in our brains could unlock safer medications
1p5jzqg,2,Turning fat cells into bone heals fractures and reverses frailty
1p4nlj3,5,First totally synthetic human brain model has been realized
1p4nev6,0,AI trained on bacterial genomes produces never-before-seen proteins
1p3tb7w,0,"Milk protein put to use in spiciness-gauging ""artificial tongue"""
1p2zi7q,5,Speech-restoring brain chip gets FDA approval for human trial
1p22lah,2,World first: Breath-saving exoskeleton turbocharges diver's kicks
1p0da7j,2,"Small, inexpensive hydrophone boosts undersea signals"
1oymihf,5,Turkey tail mushroom provides alternative to single-use plastic wrap
1oy5ob7,5,"New nanoparticle mRNA vaccine may be cheaper and 100 times more powerful | Unit-per-unit, the experimental nanoparticle-enhanced mRNA vaccine reportedly does the work of a hundred times as much of its FDA-approved equivalent"
1oxrrdk,5,Nuclear waste may hold the key to greener hydrogen production
1ox1c7t,5,Revolutionary biofuel battery is inspired by human metabolism | Using glucose and riboflavin in the creation of a biofuel flow cell which functions similarly to a human cell.
1owvj8c,5,"Injectable weight-loss drug helps shift stubborn pounds post-surgery | When post-surgery weight loss is suboptimal, introducing one of the newer weight loss drugs can help"
1ow30qa,0,New lightweight polymer film can prevent corrosion
1ow04l6,5,Interstellar-inspired TARS3D may be first such robot that both walks and rolls | Scientists have created a real-life functional version of the TARS robot from the movie Interstellar
1ov6kj6,0,Teaching robots to map large environments
1ov3lkv,5,"MIT's injectable brain chips could treat disease without surgery | MIT's Circulatronics tech sees tiny chips injected into the bloodstream to reach the brain, negating the need for invasive surgery to deliver treatment for neurological disorders"
1ouafw0,5,A new way to understand and predict gene splicing
1ou80lz,0,MIT physicists observe key evidence of unconventional superconductivity in magic-angle graphene
1ou7znr,5,One-off lipid-lowering gene therapy a success in world-first human trial | A new gene therapy lowered two heart disease-related lipids in a human clinical trial
1ote4b3,5,A new patch could help to heal the heart
1osl0gs,5,New therapeutic brain implants could defy the need for surgery
1osjysu,0,"Giving buildings an “MRI” to make them more energy-efficient and resilient | Lamarr.AI uses drones, thermal imaging, and AI to help property owners make targeted investments in their buildings."
1osjwmp,5,Smart dressings and stem cells: The future of wound healing | Researchers have compared newer wound-healing tech to conventional therapies and dressings
1orqtni,5,MIT study finds targets for a new tuberculosis vaccine
1orpz0n,5,Particles that enhance mRNA delivery could reduce vaccine dosage and costs
1orhdth,2,SpaceX reveals simpler lander to speed up Moon return
1or1vt6,5,"Students built a robot that can withstand more than 1,000 degrees Fahrenheit"
1oqupu3,5,A Neuralink patient with ALS is using his brain implant to control a camera and look around again
1opzkar,0,3D-object-making machine forgoes printing for knitting
1opviil,5,‘Mind-captioning’ AI decodes brain activity to turn thoughts into text
1op363o,3,Simple saliva test catches heart failure before you know you have it
1oo8t1s,5,Designer drug targets both heart disease and diabetes
1ond2wz,0,"Designing better, longer-lasting medicines"
1omhwkm,0,Biochips made from mushrooms rival power of manmade semiconductors
1oj4pzt,5,Fat breakdown fuels new hair growth in breakthrough study
1oi8wdr,0,Swiss smart socks help diabetics feel their feet again
1ogkg1j,2,New Space Armor shields satellites from hypersonic space debris
1ofs1gu,2,Forensics’ “Holy Grail”: New Test Recovers Fingerprints From Ammunition Casing
1ofqd2z,9,Startup’s tablets deliver cancer drugs more evenly over time
1ofezo6,2,Miami Has a New Cop on the Beat: A Drone-Launching Police Car That Can Drive Itself
1oexycx,0,Real-Time Audio Deepfakes Are Now a Reality | A cybersecurity firm has created convincing voices on the fly
1oexxcb,5,AI teaches itself and outperforms human-designed algorithms
1oex8bb,5,Pioneering eye implant restores reading vision to the blind
1oe4r3q,5,A new autonomous fighter jet just broke cover. It's powered by the same AI brain that flew an F-16 through a dogfight.
1oe2ib9,2,Bowel cancer’s “sugar shield” removed to reawaken immune defenses
1oaotd7,2,Sake to the stars: Japan’s lunar brewing experiment set for takeoff
1o9xy5p,4,Ulcer-treating device is like a little pen that you swallow
1o861b4,5,New approach shields memory from brain cancer radiotherapy
1o7adwi,1,Helping scientists run complex data analyses without writing code
1o6eogc,2,Two-pronged approach cuts sleep apnea events by 68%
1o5j1j1,5,Naked mole-rat DNA repair could unlock natural human longevity
1o4p02i,5,Engineered “natural killer” cells could help fight cancer
1o3vw6e,2,Forged in disorder: High-entropy MXenes emerge as a new material
1o24xx8,7,New daily pill shows strong results in ulcerative colitis clinical trial
1o0i23l,5,"New sunlight-powered film kills 99.995% bacteria to provide safe drinking water | It offers a simple, affordable, and robust solution to the global safe drinking water crisis."
1o0dk1n,2,"Printable aluminum alloy sets strength records, may enable lighter aircraft parts"
1o0b42k,8,Tiny lab-grown brains could help build the next generation of computers | Biocomputing has left the realm of science fiction and entered the laboratory
1nzmd2l,2,"Ocean CO2 becomes sustainable plastic, thanks to modified microbes | Turning dissolved carbon dioxide from seawater to biodegradable plastic is an especially powerful way to clean up the ocean"
1nzfpoi,5,How Wi-Fi Signals Can Be Used to Detect Your Heartbeat | Contactless pulse monitoring opens up new wearable possibilities
1nzfgso,0,Chemists create red fluorescent dyes that may enable clearer biomedical imaging | The new dyes are based on boron-containing molecules that were previously too unstable for practical use.
1nzfd73,2,"Smart in-asphalt fabric provides live reports from within roads | Once embedded in the asphalt, the sensor fabric’s job is to provide continuous measurements"
1nzfaht,2,"'Sugar switch' in the brain offers new path to treating depression | Removing the St3gal1 enzyme in healthy mice caused depressive symptoms, increasing St3gal1 in stressed mice had the opposite effect, easing those behaviors."
1nxv83p,5,Parachutes with hundreds of holes could enable safer drone deliveries
1nxscj6,0,"A groundbreaking study has revealed that your mom and dad’s DNA don’t just pass on telomere length, they actively reshape it in the first days of life, influencing how we age and our risk of developing diseases such as cancer."
1nwzuea,2,NASA moon rover project pushes extreme battery tech to its limits
1nwvnsp,5,Next-gen imaging tech could catch sight-stealing diseases early | A powerful new imaging tool offers unprecedented 3D vision of the retina
1nw5nqm,5,"MIT's concrete battery just got 10 times more powerful | Researchers found a way to combine cement, water, and carbon black to create a 'supercapacitor', expanding the storage capacity by nearly 10 times."
1nw2k8b,5,This chip uses light to supercharge AI and cut energy use
1nw0fgn,5,"Palladium filters could enable cheaper, more efficient generation of hydrogen fuel | The novel design allows the membranes to withstand high temperatures when separating hydrogen from gas mixtures."
1nvzkbv,5,"Notorious Alzheimer’s protein also supercharges cells against cancer | Scientists have found that a byproduct of amyloid-beta rejuvenates T cells, boosting their tumor-fighting power and dramatically reducing cancer risk."
1nvjz4n,0,"Edible sensor warns of flu by tasting like thyme | The molecular sensor contains a phenolic compound called thymol, which is found in thyme"
1nv7jq1,0,Artificial neuron melds electronics and biology to function like the real thing
1nv6bxv,5,Oak Ridge's new 3D printer can mix and match materials at massive scale | Scientists unveil multiplexed nozzle for next-generation 3D printing
1nuwsa7,5,Study finds key role for non-neural brain cells in processing vision | MIT researchers employed a novel application of tools and analysis to show that astrocytes ensure neural information processing by maintaining ambient levels of the neurotransmitter chemical GABA.
1nucil7,2,A boost for the precision of genome editing
1nuce6u,2,"Spider-like construction robot promises to build a home per day | Being autonomously capable of building a 2,150-sq-ft home in a single day – operating at roughly the speed of 100 bricklayers."
1ntgxhg,2,"Low-dose radiation relieves knee osteoarthritis pain, improves function"
1nsnyq5,2,“Bottlebrush” particles deliver big chemotherapy payloads directly to cancer cells
1nsnjy0,2,"UV light is a fast, effective way to deactivate indoor airborne allergens | UV222 light is a passive, quick way to inactivate indoor airborne allergens like cat dander"
1nsnjej,0,Microwave weapon downs 49 drones with a single blast | In a demonstration not so much of marksmanship but more of the advantages of microwaves.
1ja0lq3,0,"Swirling sound waves used to rip apart kidney stones | Scientists have devised a method of non-invasively tearing the objects apart, using what are known as ""acoustic vortex beams."""
1n913g4,5,Futuristic eye implant bypasses cornea to beam images straight to retina | A tiny new implant may mean waiting for donor corneas to restore vision will soon be a thing of the past
1ne7bwn,5,Technology originating at MIT leads to approved bladder cancer treatment
1mo51x1,5,"New schizophrenia drug improves symptoms current drugs can’t touch | A novel drug, Evenamide, quieted overactive brain circuits in an animal model of schizophrenia, improving memory, social interaction, and dopamine balance."
1j1e96m,5,Gene therapy surgery restores some vision to legally blind children | All 11 children in the clinical trial saw improvements within weeks of a single surgical treatment.
1jtjaun,2,UK hypersonic missile engine aces ground tests | With their ability to fly at speeds in excess of five times the speed of sound
1kvv8do,5,Canine cancer drug fast-tracked for treating kids | Positive results from clinical trials of an immune therapy in dogs with bone cancer have been used to fast-track the development of the drug to treat children with the same cancer.
1ly0ne8,2,Lucid absolutely smashes Guinness World Record for the longest EV drive on a single charge
1mh9zaf,5,"A newly discovered receptor switch that boosts bone growth could transform how we treat osteoporosis, by stimulating the body’s own bone-building machinery using a targeted drug and even mechanical force."
1nbkecg,2,A single fecal transplant provides years of health benefits | A capsule full of healthy gut bacteria provided obese teens with health benefits for years
1iu54bb,5,AI cracks superbug problem in two days that took scientists years
1n7bpsj,2,OTC nasal spray reduces the risk of COVID-19 infection by 70% | Azelastine nasal spray could provide an additional easily accessible prophylactic to complement existing protective measures.
1m4m67o,2,Mysterious radio pulses beneath Antarctica defy rules of particle physics | The unusual radio signals were first detected nearly ten years ago by a special experiment designed to detect radio waves caused by cosmic rays hitting the atmosphere.
1j385xq,2,Image of prototype XB-1 caught breaking the sound barrier
1ncimc4,5,Scientists create solar cells that generate energy from indoor light at record efficiency
1lf8eir,5,Anti-aging drug as good for cell health as dieting or fasting | Rapamycin is just as effective in protecting cells and cognitive function as cutting calories or intermittent fasting (IF).
1iuo774,2,"Infant's genetic muscle disorder improved by treating pregnant mother | Case study demonstrates a simple new treatment, with a child showing no signs at all two and a half years after birth."
1loyi2g,5,"Researchers have discovered that newborns have high levels of the tau protein, which is elevated in older people with Alzheimer’s disease, but that it causes them no harm | The discovery opens the door to developing new ways of treating or preventing the neurodegenerative condition."
1ls62ar,2,This device uses a laser to shoot down 30 mosquitoes per second — LiDAR-guided 'Photonmatrix'
1jweua7,5,US scientists create most comprehensive circuit diagram of mammalian brain | The 3D map of a cubic millimetre of mouse brain reveals half a billion synapses and 5.4km of neuronal wiring
1ljhrn8,1,Mosquito-sized drone is designed for Chinese spy missions — military robotics lab reveals incredibly tiny bionic flying robots | Science fiction becomes reality.
1k1s91e,2,"Revolutionary forensic tech gets gunshot residue to glow green | The technology could allow police officers to detect gunshot residue on suspects right at crime scenes, instead of via lab-based tests days later"
1l7uoc4,0,"""Game-changer"" celiac test detects disease without triggering symptoms | Current methods of diagnosing celiac disease can be extremely painful and invasive"
1lyrivl,5,'Junk' RNA molecules help to regrow damaged nerves | The discovery could unlock new ways to treat nerve injuries and even restore growth in the brain and spinal cord.
1l8q195,5,Sea cucumber compound could be key to a new cancer therapy | The sea cucumber produces a sugary compound that can inhibit cancer spread
1kcz408,5,"Early Parkinson’s diagnosis possible with simple, non-invasive eye scan"
1n1dlew,5,"Plaque-hunting nanoparticles detect and disarm the driver of heart disease | Researchers have engineered porphyrin-lipid nanoparticles that can identify artery build-up, break down the plaques and suppress inflammation"
1kljihz,0,Lead becomes gold for split second during LHC experiments
1kzuixq,0,Larvae-attracting gel could help repopulate decimated coral reefs
1jinrye,5,Prostate cancer surgery breakthrough offers hope for erectile function | Neurosafe procedure allows doctors to remove prostate while preserving as much nerve tissue around it as possible
1k54w5d,5,New ultrasound drug delivery system found to be highly effective against bacterial biofilms | This offers a promising solution that could address the global crisis of chronic antibiotic-resistant infections affecting hundreds of millions of people worldwide.
1np8wdt,0,"Nano-cubosome eyedrops that can ferry protective compounds all the way to the retina, target macular degeneration without needles"
1nl08em,5,"By knocking out a protein duo’s “bodyguard” role, researchers have exposed a hidden weakness in pancreatic cancer | It’s a discovery that could lead to smarter, more effective treatments for one of the deadliest cancers."
1lwa2nu,0,"Autonomous robot surgeon removes organs with 100% success rate | ""This advancement moves us from robots that can execute specific surgical tasks to robots that truly understand surgical procedures."""
1nixv6a,5,"A new study shows that a personalized, precise form of brain stimulation, HD-tDCS, can rapidly ease depression symptoms – and even reduce anxiety – offering a promising drug-free alternative with only mild side effects."
1jfm6pe,5,"Nearly 100% of cancer identified by new AI, easily outperforming doctors | In what's expected to soon be commonplace, AI is being harnessed to pick up signs of cancer more accurately than the trained human eye."
1lls6nb,5,"Lab-grown mini-brain given epilepsy drug learns in real time | For the first time, a lab-grown brain-computer system has demonstrated that human neurons living and evolving in an artificial system respond to medication by learning, in real time, in a game-like environment."
1jda7xr,5,"Abandoned mines could find new use as gravity batteries | The scientists behind a new study estimate that, worldwide, there are likely millions of disused mines suitable for energy storage"
1jub3o5,5,Fusion rocket could cut Mars trips in half and reach Pluto in four years | New Sunbird rocket uses star-like fusion to propel spacecraft
1ky9obd,5,"Israel confirms world-first combat use of laser-beam weapon, downs Hezbollah drones | The new laser weapons will complement Iron Dome defenses"
1m8vzju,5,Marathon Fusion says it can produce gold as fusion reactor byproduct | Fusion reactors could turn common mercury into gold
1kieoo9,2,Modular carbon capture tech slashes cargo ship CO2 emissions by 70%
1mw6qok,2,"Implantable heart patch seals holes and regenerates tissue, showing promise as a safer alternative to current surgical materials."
1jap39a,5,"Green steel plant glugs out first ton of molten metal | With clean electricity, the process could make steel with zero CO2 emissions."
1n1zdw3,7,The world's largest sand battery just went live in Finland
1iyo3wg,5,Scientists Just Created Shape-Shifting Robots That Flow Like Liquid and Harden Like Steel | Researchers have designed a robotic material that transforms like a living organism.
1mthwb7,5,FDA approves landmark fibromyalgia drug that works like no other | People living with fibromyalgia will soon have access to a novel therapy designed to tackle the condition’s most elusive symptom: Poor-quality sleep.
1kf7p1a,0,The future of data storage might be ceramic glass that can last thousands of years | Cerabyte's ceramic glass storage endures boiling and baking in extreme durability tests
1k3k1ll,1,"New graphene-based flash memory writes data in 400 picoseconds, shattering all speed records | ""PoX"" can execute 25 billion operations every second"
1itdp6r,6,"Microsoft unveils chip it says could bring quantum computing within years | Chip is powered by world’s first topoconductor, which can create new state of matter that is not solid, liquid or gas"
1jqfpcp,5,Scientists Use Sound to Generate and Shape Water Waves | The technique could someday trap and move floating objects like oil spills
1l27wty,2,"100% of bacteria bounce off surfaces coated with “flea-jumping protein” | It relies on the unique properties of resilin, a natural insect protein that enables fleas to jump hundreds of times their body length."
1jv45dc,2,Stroke breakthrough takes aim at the gut
1iqzjwu,1,Scientists use crystals to cram terabytes of data into millimeter-sized memory | Crystal defects create ultra-dense memory
1j5r7jz,5,"Gene-edited non-browning banana could cut food waste, scientists say | Fruit variety developed in Norwich remains fresh for up to 12 hours after being peeled"
1lsye3h,5,Landmark study reveals cell-level brain changes tied to PTSD | The findings paint a detailed picture of how trauma leaves lasting marks on the brain—right down to the cell level.
1lqopg3,0,Underwater tidal turbines get a 6-year reliability boost
1isevm3,0,Scientists Created the Lightest and Strongest Nanomaterial Ever
1lzo4xb,5,"Painless breast cancer scan promises accurate results in under a minute | Breast cancer claims hundreds of thousands of lives per year, but new screening methods are making it easier to detect it early"
1n4vm2r,5,Plant-based microbeads act as 'fat magnets' for drug-free weight loss | These plant-based microbeads absorb and trap fat
1ldj06n,5,"Brown fat “repressor” protein targets cancer-related weight loss | The discovery opens the door to developing treatments for the extreme weight loss, muscle wasting, and malnutrition seen in some types of cancer."
1jcl4iz,2,Green steel plant glugs out first ton of molten metal
1ladxsp,5,MIT's water harvester works in extreme climate without power or filters
1n89zwc,5,"Ice makes electricity when bent or stretched, physicists report new discovery | Findings could pave the way for advanced cold-climate electronics"
1m2yd0l,7,Ion clock has accuracy that outlives the universe | Atomic clock has broken the record with an accuracy of 5.5 x 10⁻¹⁹ – gaining or losing one second in 57.6 billion years.
1lf9yks,5,"Doctors find Parkinson's markers by looking inside ears | Analysis of ear wax to detect Parkinson's Disease would be a cheap, non-invasive way to detect the condition in its early stages"
1ni2n9i,5,"Inexpensive New Water-Based Liquid Battery Could Replace $10,000 Lithium Systems"
1noefxk,5,Tumor-targeting Salmonella engineered to boost colon cancer survival | Scientists have engineered a species of Salmonella that self-destructs inside colon cancer tumors
1nk4xv9,5,"Common daily pill slashes colorectal cancer’s return by 55% | A study involving more than 1,000 cancer patients has found that a low dose of aspirin halves the risk of colorectal tumors returning after surgery."
1k3d2nw,0,95% of flu and herpes infection neutralized by chewing gum | Chewing gum – but not any gum. This one is made from a rather fascinating bean.
1lkxfq5,5,"‘Single shot’ malaria vaccine delivery system could transform global immunization | Oxford researchers have developed programmable microcapsules to deliver vaccines in stages, potentially eliminating the need for booster shots and increasing immunization coverage in hard-to-reach communities."
1ngrj9k,5,New RNA tool to advance cancer and infectious disease research and treatment
1l1iq73,5,Alzheimer's hope: Sleep aid blocks up to 40% more harmful tau deposits | Treatment with lemborexant resulted in larger volume in the hippocampus and a smaller gap in brain tissue compared with another sleep aid treatment.
1jz44tp,2,Biotech firm creates weight loss pill that mimics the effects of gastric bypass surgery | The pill preserves muscle mass while reducing hunger
1k7i9ux,5,"Forget about mousetraps – scientists build a better, less splashy urinal | An experimental new urinal design could help eliminate the evils of ""splashback."""
1kehxf0,5,New fusion rocket design could cut Mars trip to under 4 months
1ldl71a,0,Scientists genetically engineer a lethal mosquito STD to combat malaria | Researchers have bioengineered a deadly fungus that spreads sexually in Anopheles (malaria-spreading) mosquitoes.
1nhil2u,5,"Eye drops could replace glasses or surgery for longsightedness, study says | Research shows most patients can read extra lines on eye test charts after twice-daily treatment"
1nez3ay,5,Promising new epilepsy drug delivers 80% reduction in seizures | Adults with drug-resistant focal onset seizures are the target of experimental epilepsy drug RAP-219
1n9x4kp,5,"Seaweed could help build the cities of tomorrow | A common form of seaweed, piling up on tropical beaches, could be used to make eco-friendly concrete"
1jplwq8,2,NASA uses force field on Moon to sweep away deadly dust
1r1uqfh,0,Quesma tested AI on backdoored binaries and Claude Opus found 49%
1r1sdug,1,"Coupang breach, what ""management failure"" looks like in auth systems"
1r1sdu8,0,OpenClaw is spreading fast on corporate endpoints. We built a tool to hunt and neutralize it.
1r1qu9s,1,"I got tired of maintaining 50+ janky Python scripts for security automation, so I built a visual engine to replace them (Open Source)"
1r1psut,4,10 Years as a Tech PM : How do I pivot to Cyber without knowing to code or doing a bootcamp?
1r1pqdk,8,Is Network and Information Security basically cybersecurity or not?
1r1orr2,0,Article Posting on EBR
1r1nkzy,1,Roles in CyberSecurity Awareness and Education?
1r1m99r,3,"Has anyone heard of or works for, Secure IT?"
1r1m76n,0,Antivirus/EDR on Pentest Laptops?
1r1l2o2,3,What do y’all do
1r1jjob,1,Cybersecurity Professionals Needed for Android Malware Detection Research (Academic Study)
1r1iuew,8,What's the actual risk of typosquatting attacks in 2026?
1r1ijan,2,Cyber security birthday gift
1r1h51x,1,"Fresh cybersecurity graduate offered solo IT role to build full infrastructure from scratch, good experience or bad move?"
