post_id,cluster_id,text
1r2ugsz,3,Big blimp uses blades to pull wind power out of the sky
1r2k67c,6,Engineers Just Developed a Perfect Material for a Truly Unsinkable Ship
1r1y4dy,8,Sugar molecules used to destroy antibiotic-resistant bacteria
1r12llt,6,A quick stretch switches this polymer’s capacity to transport heat
1r05d9m,6,"Harvard engineers 3D-print soft robots that bend, twist, grasp, and move on command"
1qz9ri2,8,3D-printed batteries aim to reshape energy storage in small devices
1qz3n1m,8,Breakthrough: Scientists Created a 'Universal' Kidney To Match Any Blood Type
1qyj2fh,0,Sixteen Claude AI agents working together created a new C compiler
1qyf0di,3,This fusion energy startup thinks it can cut lasers out of the equation
1qxil2p,8,Wood scraps turn 'useless' desert sand into concrete
1qwz2os,3,"People Could Be ‘Resurrected’ in Robotic Bodies One Day, Futurist Believes. Now He’s Taken the First Step."
1qwni2u,0,A New AI Math Startup Just Cracked 4 Previously Unsolved Problems
1qwmeyk,8,Microneedle patch uses bubbles to fight stubborn acne
1qvy73x,8,AI model OpenScholar synthesizes scientific research and cites sources as accurately as human experts
1qvp4hl,8,Underwater 3D printing is edging in to transform maritime construction
1quuj34,3,The Large Hadron Collider will now heat homes as well as smash particles
1qtwjfo,6,Engineers just found a way to cool quantum systems using microwave noise
1qtr5ht,8,"Toxin Stops Colon Cancer Growth, Without Harming Healthy Tissue"
1qszrap,8,New ultrasound pad aims to make prenatal visits less unpleasant
1qsqfpv,8,New Drug Stops Weight Gain and Lowers Cholesterol by Targeting Nitric Oxide
1qsf709,8,48 hours without lungs: artificial organ kept man alive until transplant
1qs4hg4,1,Hybrid jet engines work to excel where pure-electric jets fail
1qrata5,9,Chip stress-tests blood cells to see if donated blood is still good enough
1qr22va,8,"Days numbered for 'risky' lithium-ion batteries, scientists say, after fast-charging breakthrough in sodium-ion alternative"
1qq9h2y,8,Radio capsule lets doctors know when patients miss their meds
1qq4imf,6,Unlocking defect-free graphene electrodes for transparent electronics
1qpyl7w,8,Scientists Identify an Epigenetic Switch That Can Slow Production of Fat Cells
1qpok5x,8,Scientists achieve pancreatic tumour regression in breakthrough study
1qpferj,8,Goodbye to fragile solar cells: New method makes them almost eternal
1qpcts9,8,A new chemical trick could extend lithium-ion battery life without redesigning cells
1qoi3w1,0,Models that improve on their own are AI's next big thing
1qofe50,6,Electrifying boilers to decarbonize industry
1qo12gu,8,Using amino acids as fuels to make conductive graphene
1qnleri,8,This Immune Therapy Repaired Gut Damage for a Full Year
1qnk0ut,6,China reveals 200-strong AI drone swarm that can be controlled by a single soldier — ‘intelligent algorithm’ allows individual units to cooperate autonomously even after losing communication with operator
1qnhauo,8,Gene editing takes a major step toward ending daily cholesterol pills
1qmmuvl,8,Stress-reduction molecule has potential to treat aging and metabolic disorders
1qmkylh,3,UCLA engineers discover the most heat-conductive metal ever measured
1qlvhas,8,Scientists May Have Found a Blueprint to Revive Old Cells
1qlo9ok,8,Scientists print human liver tissue in breakthrough that could save lives
1ql8ewk,6,UC Irvine engineers invent wireless transceiver rivaling fiber-optic speed
1ql87uu,8,New filtration technology could be gamechanger in removal of Pfas ‘forever chemicals’
1ql2wxh,0,Why Apple and OpenAI are reportedly betting on AI hardware in 2026
1qkrlsi,0,This robotic hand can crawl away from its arm to grab things
1qkk54s,8,Billion-times more efficient fusion unlocked with low-frequency laser
1qjwq10,8,Forestry-waste pine bark could be used to pull antibiotics out of wastewater
1qjtluw,3,Building the world's first open-source quantum computer
1qj3ubg,6,MIT’s new ‘recursive’ framework lets LLMs process 10 million tokens without context rot
1qiyvmy,0,Battlefield wound spray stops bleeding in just one second
1qiofgy,8,Scientists Discover the Body’s Natural “Off Switch” for Inflammation
1qi5qap,8,Magnets produced at room temperature using lasers could produce faster non-silicon processors
1qi1ui1,8,Researchers build a stretchable OLED that can double in size without dimming
1qh5bqq,8,A protein found in the GI tract can neutralize many bacteria
1qg9dem,3,Chemists determine the structure of the fuzzy coat that surrounds Tau proteins
1qfejyt,8,Scientists create a spray-on powder that seals life-threatening wounds in seconds
1qeg7uz,8,Efficient cooling method could enable chip-based trapped-ion quantum computers
1qeftaw,0,AI models are starting to crack high-level math problems
1qdkdz6,8,Could glowing green skin be an alternative to blood sampling?
1qcnwbl,8,"Scientists develop nanophotonic material that changes color, texture, and shape on demand"
1qbrxib,8,A single inflammatory switch may help repair the liver
1qavcqn,7,These paper batteries made from plants want to replace AA and AAA cells
1qa1gn0,6,Spray-on armor for plants offers a new tool for global food security
1q94q7g,3,Pills that communicate from the stomach could improve medication adherence
1q89i6h,6,AI-generated sensors open new paths for early cancer detection
1q7f4wz,5,AI Models Are Starting to Learn by Asking Themselves Questions
1q7bqpb,8,Experimental molecule may be a potent weapon against Alzheimer’s
1q6g4an,8,AI co-pilot uses machine learning to reduce deadly sea collisions
1q5jrtz,8,First US at-home depression kit on its way after trial shows relief in weeks
1q4m09m,8,'Microneedling' of plants could boost growth and reduce fertilizer waste
1q3qapf,8,Nano-magnets may defeat bone cancer and help you heal
1q1ym6n,5,Silicon 'postage stamp' implant instantly emails your thoughts to AI
1q14jnt,8,How battery charging led to a breakthrough in lithium recycling
1q0dhrx,8,Injectable antibodies in nanoparticles could replace hour-long infusions
1pzikee,8,Tiny under-scalp implant could restore lost senses through prostheses
1pyngm2,3,Anything-goes “anyons” may be at the root of surprising quantum experiments
1pxrv0j,8,Mosquitoes' stabby suckers may find use in high-res 3D printers
1pw4x86,6,Magnetic cloaking is moving from theory to real-world engineering
1pvdysj,8,World's smallest autonomous robots could one day save your life
1puo9sj,8,'Stingraybot' uses microbubble muscles controlled by ultrasound
1ptvjpf,3,AI-powered 'glasses' help the blind go places – safely
1pt0kv0,9,Leaf-scan tells farmers when fruit is ripe – without destroying it
1ps7gcz,3,No DNA evidence at crime scene? Protein analysis comes to the rescue
1prfa9p,0,15-minute hep-C test makes same-day treatment possible
1pqmdwz,8,Scientists find a way to 'reboot' vision in adults with lazy eye
1ppre9i,6,Helical rover wheel balloons from 9 to 20 inches &amp; survives fire
1poxptt,8,Frog gut bacterium eliminates cancer tumors in mice with a single dose
1poa0sn,8,ExxonMobil Unveils Graphite Invention To Extend EV Battery Life By 30%
1po31w8,7,Futuristic pixel-raising display lets you feel what’s onscreen
1pn89ot,8,A new way to deliver antibodies could make treatment much easier for patients
1pmf21x,8,Radial-flux motors supercharge new hybrid supersonic engine design
1plmu7w,2,ADHD 'audio shield' turns sounds from daily tasks into powerful focus tool
1pktgse,8,California startup's new fire-suppression system uses sound instead of water
1pjydlg,8,Soft robots can now see with a self-focusing squishy eye
1pj47oh,8,Watch: Glowing tool seeks out DNA damage in real time
1pi9cns,8,"Pneumatic-suction robot clears 75,000 lb of cargo an hour"
1phd3lf,7,Underwater arms race: How robot subs will outwit next-gen sonar
1pgjktv,8,MIT researchers “speak objects into existence” using AI and robotics
1pfqaa8,8,First-ever drug to repair DNA and regenerate damaged tissue is here
1pe22mw,8,Noninvasive imaging could replace finger pricks for people with diabetes
1pd5ufz,8,DragonFire laser weapon takes down high-speed drones
1l9jwmy,8,Pancreatic cancer vaccine eradicates trace of disease in early trials
1malrbm,8,The first 100% effective HIV prevention drug is approved and going global
1josvxn,8,"Men’s turn: US scientists unveil a hormone-free male birth control pill | YCT-529, a hormone-free pill developed by US researchers, has shown 99% effectiveness in trials and is now in human testing."
1o2zyym,8,Next-gen vaccine prevents up to 88% of multiple aggressive cancers
1ndb43u,8,"World's first koala chlamydia vaccine approved for rollout across country | Vaccine will protect koalas from the widespread disease that causes painful urinary tract infections, infertility, blindness and death."
1js1ehb,8,Shingles vaccine found to cut dementia risk by 20% | The findings bolster a growing body of research linking the vaccine to lower numbers of dementia cases.
1mj12h4,8,New mRNA vaccine stops malaria transmission in its tracks | A 99.7% drop in the rate of transmission of the malaria-causing parasite recorded in preclinical studies.
1m3vhen,8,'Universal cancer vaccine' trains the immune system to kill any tumor
1ledup7,8,"The World’s Largest Sand Battery Just Went Online in Finland. It could change renewable energy | This sand battery system can store 1,000 megawatt-hours of heat for weeks at a time."
1knxj3r,8,"US doctors rewrite DNA of infant with severe genetic disorder in medical first | Gene-editing breakthrough has potential to treat array of devastating genetic diseases soon after birth, scientists say"
1jlqdzt,8,"New plastic dissolves in the ocean overnight, leaving no microplastics"
1lbeyh6,8,Topical CBD quickly and effectively kills off deadly fungal infections | The discovery comes as the World Health Organization urgently calls for new treatments for potentially deadly fungal infections.
1lgvxgt,8,"Single psilocybin dose can relieve cancer-related depression long-term | A single dose of psilocybin coupled with “talk therapy” can significantly reduce depression in people with cancer for up to two years,"
1lcq6px,8,"This Plastic Dissolves in Seawater and Leaves Behind Zero Microplastics | Japanese scientists unveil a material that dissolves in hours in contact with salt, leaving no trace behind."
1kc5wzx,8,"Psilocybin an effective treatment for repeated concussions, study suggests | Psilocybin, the psychedelic ingredient in magic mushrooms, could be an effective treatment because of its brain-healing properties."
1o90ynn,8,95% of kids with “bubble boy” disease cured by one-time gene therapy
1iwzemh,8,"Transplanting insulin-producing cells along with engineered blood-vessel-forming cells has successfully reversed type 1 diabetes, according to a new preclinical study | With further testing, the novel approach could one day cure the as-yet incurable condition."
1jk858p,8,Nearly 100% of bacterial infections can now be identified in under 3 hours | A major breakthrough in the accuracy and speed at which often deadly pathogen infections can be identified and treated.
1kik7kv,8,PTSD treatment that excites a nerve in your neck wipes symptoms completely
1kqjojj,8,World’s first gene-edited spider produces red fluorescent silk
1obhtwa,8,Cancer drug combo slashes risk of death by more than 40%
1m9oz0h,8,"Temporary tattoo could prevent sexual assaults – by changing color | In this proof-of-concept tattoo, lettering changes from yellow to red when exposed to the date rape drug GHB"
1l4oop9,8,Scientists develop plastic that dissolves in seawater within hours | Fast-dissolving plastic offers hope for cleaner seas
1jfkhgi,8,Breakthrough stroke drug heals the brain to restore movement | This drug discovery promises molecular rehabilitation for stroke patients
1jiyhj0,6,"Paralysed man stands again after receiving ‘reprogrammed’ stem cells | Another man also regained some movement, but two others experienced minimal improvement."
1k19xfz,8,British Army energy weapon blasts drones by the swarm simultaneously and near instantaneously using high-frequency radio waves at a cost of 10p (US$0.13) per shot.
1jbkjdq,8,New tinnitus treatment emerges from blocking back-channels in the ear | The discovery of a strange mechanism between the ear and the brain could lead to a new potential tinnitus treatment
1m76905,8,"World-first obesity pill reprograms fat cells to burn calories with zero effort | The first human-tested weight-loss drug that burns calories through creatine-based heat generation, without reducing appetite, has successfully completed its Phase I trial."
1k92747,8,Himalayan fungus compound tweaked for 40x anti-cancer boost
1n34hrg,3,Shingles vaccine linked to heart attack and stroke prevention | A new study supports the idea that the shingles vaccine could keep you out of the hospital from a cardiovascular event
1m26o94,8,France runs fusion reactor for record 22 minutes
1ipz7tn,8,"Alzheimer's biomarkers now visible up to a decade ahead of symptoms | Researchers have devised a biomarker test that can spot small amounts of clumping tau protein in the brain and cerebrospinal fluid, which lead to Alzheimer's disease."
1kbe5rd,6,We now have evidence of how old trees share critical intel with forest youth
1mmpcni,8,Side-effect-free male contraceptive pill achieves milestone in its human trial
1mp15xx,8,"First antidote for carbon monoxide poisoning ""cleans"" blood in minutes | An engineered protein that acts like a molecular sponge has the potential to change how carbon monoxide poisoning is treated"
1j0ny9l,8,Type 1 diabetes reversed by new cell transplantation technique
1mjwlvn,8,FDA approves breakthrough eye drops that fix near vision without glasses | These new drops offer up to 10 hours of clearer vision without glasses
1mlleu6,8,Diabetes patient produces own insulin after gene-edited cell transplant – without anti-rejection drugs | A potential major step toward a type 1 diabetes cure
1izf8ld,8,Self-healing asphalt uses plant spores to keep potholes from forming
1jzt1z2,8,Scientists Witness Living Plant Cells Build Their Own Cell Walls for the First Time
1kg30my,3,"Immune system found to trigger fear, but psychedelics block it | The finding could improve the treatment of both mental, emotional and physical afflictions."
1kdrdqk,8,Fecal transplants reduce alcohol cravings as human trials progress
1ld4hz7,8,Non-Hallucinogenic LSD Analogue Shows Promise for Psychiatry
1pcaqfi,8,3D-printed cornea restores sight in a legally blind patient for the first time
1lilqfb,8,People With Severe Diabetes Are Cured in Small Trial of New Drug
1m5gi4t,8,Scientists Are Now 43 Seconds Closer to Producing Limitless Energy | A twisted reactor in Germany just smashed a nuclear fusion record.
1o1ahsj,8,'Breakthrough' blood test detects chronic fatigue in 92% of cases
1lk1hs8,8,"MIT's one-shot vaccine could deliver robust protection from HIV | Using a combination of two powerful adjuvants, researchers at MIT have come up with a strong vaccine that could prove effective against HIV and other diseases"
1jbt0kk,0,Apple Plans AirPods Feature That Can Live-Translate Conversations
1ovyj9z,8,Natural molecule reverses memory loss seen in Alzheimer's disease | Scientists identify a new weapon in restoring memory to Alzheimer's disease patients
1l5iq3f,8,"One dose of liposome-laden gel eradicates ear infections in 24 hours | The gel has been successfully tested on animals, and should hopefully be just as effective on humans"
1iohwmv,8,Researchers find cancer's 'off-grid' power supply – and how to cut it | Researchers have discovered a particular type of cancer cell that relies on its own biological electric utility. Disrupting the utility with the help of a puffer fish – showed a breakthrough way to fight the tumors.
1odbuvo,1,App that translates speech to sign language in real-time wins top innovation prize
1jl2bqj,8,Stinky frog leads to powerful antibiotic that's easy on the gut
1od780y,8,IBS breakthrough: Serotonin-making gut bugs restore bowel function
1jr9chx,8,A 180-year-old drug may be the fastest depression treatment ever discovered | A new study shows that nitrous oxide may provide fast relief for those struggling with depression when traditional treatments fail.
1owxoyv,8,MIT senior turns waste from the fishing industry into biodegradable plastic
1k6o94z,3,"Japan shows off electromagnetic railgun for blasting hypersonic missiles | It's able to fire 40mm shells weighing 320 grams (11 oz) at muzzle speeds of up to Mach 6.5 and consumes about 5 megajoules per shot, but the goal is to boost this up to 20 megajoules in the near future."
1jmj76f,6,"No microplastic particle is safe from bounty-hunting ""microcleaners"" | Microcleaners use soft dendritic colloids to collect submerged microplastic particles, then bring them to the surface"
1mvbhq6,8,"Laser-free vision correction uses electrical current to reshape eye | In early trials, it reversed myopia without the need for traditional surgery – and could be the most radical advancement in eyesight correction technology since LASIK."
1n6fz1h,8,'Master switch' brain protein could reverse age-related memory loss | Lowering levels of a protein linked to iron in the brain could be a new way to reverse age-related memory loss
1j9ini5,8,Australian man survives 100 days with artificial heart in world-first success | Sydney surgeons ‘enormously proud’ after patient in his 40s receives the Australian-designed implant designed as a bridge before donor heart
1l9ibdx,8,"Bioengineered tooth ""grows"" in place to look and feel like the real thing | This ""smart"" implant grows new tissue and forms connections to existing nerves"
1jb07mt,8,"Directly converting skin cells to brain cells yields 1,000% success | Scientists have managed to convert mouse skin cells directly into motor neurons, skipping the usual step of stem cells in between"
1lhmble,3,"The largest map of the universe reveals over 800,000 galaxies | A new collaborative project dubbed the COSMOS-Web field has compiled the most comprehensive cosmic map ever, including images of the early universe as far back as 13.5 billion years."
1oym5mb,8,"Natural compound rejuvenates aging cells in just 28 days | Researchers have demonstrated how consuming pomegranate and walnuts, can rejuvenate the immune system while shielding us from cell damage, inflammation and chronic diseases including cancer."
1j41cvl,8,"Solar film you can stick anywhere to generate energy is nearly here | Since 2012, UK-based Power Roll is one step closer to manufacturing its lightweight film, with a new design for its perovskite solar cells that should drop production costs."
1mc7t59,8,New nonstick coating acts like Teflon – but without the forever chemicals – ideal for cookware and other everyday uses.
1j6r86x,8,"Stem cell therapy trial reverses ""irreversible"" damage to cornea | This new clinical trial has repaired this damage in patients thanks to a transplant of stem cells from their healthy eyes."
1l6bk4c,8,"1,000 dogs &amp; counting: Milestone achieved in life-extending drug trial"
1nnjbfk,8,"Ozempic killer? New drug reprograms metabolism for lasting weight loss | A new drug targets weight loss differently, leading to a more permanent fat-shedding solution."
1iwac30,4,PAC-MANN diagnoses early-stage pancreatic cancer with 85% accuracy
1lpwkya,8,"A new diabetes treatment could free people from insulin injections | In a small trial, 10 of 12 type 1 diabetes patients no longer needed supplemental insulin"
1ixsd8m,3,Bird flu breakthrough is good news for humans | New findings about the genetic makeup of the virus and one particular immune cell that all of us have. It also paves the way for fast-tracking the first H5N1 vaccine.
1lt0zso,8,"Paralyzed rats walk again, thanks to breakthrough spinal cord implants"
1oozy3b,8,A New Light-Based Cancer Treatment Kills Tumor Cells and Spares Healthy Ones
1lumg4w,3,"1,000-pound wheels and robots now farming Dyson strawberries | Dyson's vertical farming operation, which is home to 1,225,000 strawberry plants and shows you how the company is producing homegrown food for British consumers."
1nmo912,8,Key HIV weakness could pave way for a cure | Scientists now know how HIV integrates into the human genome
1kpnr2w,8,New &amp; old drug combo drops cholesterol by 49% in human trial
1kgtsfa,8,"Following a study in mice, scientists have now confirmed that silencing the MTCH2 protein in muscle tissue leads to energy-deprived human cells seeking out fat for fuel, while blocking the body's ability to store extra fat cells."
1lo3os6,8,Breakthrough brain sugar discovery turns the tables on Alzheimer's disease | Sugar stores in the brain were previously thought to be unimportant
1kkoj2z,8,Discovery of death-defying molecule could slow Parkinson’s progression | A molecule that blocks cell death could mean treatments for Parkinson's and other degenerative diseases
1lacmt0,8,"World-first ""undruggable"" cancer treatment enters human trial | Novel cancer drug PMR-116 will be put to the test in a world first trial in 2025"
1okucbg,8,New nanoparticles stimulate the immune system to attack ovarian tumors
1nynmwe,8,Psychedelic DMT shows promise as breakthrough stroke treatment
1kn6r1u,8,Natural molecule reverses age- and dementia-related cognitive decline
1jo1mtf,8,First new stroke and UTI drugs in 30 years get FDA approval
1ltu44j,8,Cough syrup protects the brain from dementia in clinical trial first | This cough medicine is an unlikely new ally in slowing Parkinson's disease dementia
1lee305,8,"Anti-aging ""glue"" naturally repairs damaged DNA to protect brain cells | A protein known as disulphide isomerase (PDI) assists against biological aging to ward off neurological degeneration including that seen in motor neuron, Alzheimer’s and Parkinson’s diseases."
1jzcvny,8,Breakthrough water filter eliminates forever chemicals using modified graphene oxide | The new filtration technology sets the stage for customizable water purification solutions
1p8vofc,6,Lining pipes with lab-grown diamonds can keep them squeaky clean
1m0gmmh,8,One treatable issue could dramatically improve life for adults with ADHD | Study calls for more attention to be paid to how treating sleep disorders can greatly improve wellbeing for people with ADHD.
1r3bclw,9,how far are we from deepfakes being as common as email phishing?
1r3a5g0,6,Exploiting Reversing (ER) series: article 06 | A Deep Dive Into Exploiting a Minifilter Driver (N-day)
1r38ati,1,MSP and cyber security in Houston
1r37gl5,0,AI in cybersecurity is mostly turd polishing - Fight me
1r37bir,2,Secure way to manage endpoint admin accounts without PAM?
1r3410l,3,Apple patches decade-old iOS zero-day exploited in the wild
1r340l8,5,Theoretical training during sabbatical
1r33zy1,6,Senegalese Data Breaches Expose Lack of 'Security Maturity'
1r33tpb,6,SIEM Maturity Framework - aiding signal vs noise
1r33pse,4,State-Backed Hackers Weaponize Google Gemini Across Cyberattack Lifecycles
1r33nan,6,Is MFA for On-Prem Servers Necessary in a Tiered AD environment
1r33ku0,6,Cyber Security Gap Analysis Tools / Templates
1r33h3u,6,A Linguistic Prompt Injection Case Study on Llama 4: Procedural Leakage and Security Contradictions in Large Language Models
1r31g0d,6,Frigate - CVE-2026-25643 - Authenticated Remote Command Execution (RCE) and Container Escape
1r31eme,6,fireflies.ai note taking app housing biometrics and voice prints.
1r315oe,5,Career Guidance
1r30wme,3,ClawHub skills are the new npm/PyPI malware vector - 15% malicious rate found
1r30hqn,0,What New York Cyber Security Events are worth going to?
1r307an,2,Sophos Pop Up
1r3058m,4,MS Word CvE 2026
1r2zma0,7,Need Advice
1r2z9ce,6,Thoughts on Zirbel Security Process Framework
1r2ye7r,1,"What security controls actually work for GenAI apps, and what fails in production?"
1r2y0f2,6,is android code security review lucrative like web ?
1r2xx2a,6,Client asking for very detailed security audit
1r2xehy,3,Should I take the certificate
1r2x638,9,Is it worth getting sec+ cert as a high school senior
1r2wg8f,7,Need Help Finding Potential Leaked Company Data
1r2utjw,6,Pen Tests on Sunsetting Technology
1r2tguo,6,How to retrieve detailed Microsoft DLP incident data via API?
1r2tgew,5,Which role helps you learn nore in cybersecurity: SOC Analyst or Pentester?
1r2s34o,6,stop corporate devices from accessing personal Hotspot.
1r2s0rj,6,Does the “Passwordless → Change Password → Passwordless” cycle guarantee session revocation?
1r2qv3c,5,Need some advice on final year project for college
1r2qt18,6,Discord’s Age Verification Defeated By a 3D Avatar You Control With a Game Controller
1r2q2c4,1,Cybersecurity final year project ideas
1r2q22f,9,CISA Certification: $800 Exam for an Outdated Auditing Cert or Actually Worth It for Cybersecurity Careers?
1r2puj1,7,How not to get pigeonholed into a regular dev role?
1r2ptwf,6,Grad Project
1r2pa3g,9,Over 5K people signed up for my AI and quantum talk
1r2p8hs,3,TrustOS the fully auditable OS
1r2ovqb,9,"AI vulnerability Agents are currently all noise and no signal. Am I expecting too much, or is the tech just not ready for prime time yet?"
1r2or4n,6,East Midlands CyberSummit
1r2ofks,1,OSCP + GovConsulting Background → Relocating to UK for Cybersecurity Work
1r2ocrc,9,10 Years Pentesting → VP IT Risk Manager. What should I realistically expect?
1r2o3dy,1,Dyscalculia + Cybersecurity
1r2nzmp,1,Training in Deepfake Detection
1r2nsuc,1,Deepfake Detection and Mitigation in Cybersecurity
1r2myr3,8,Researchers Warn: WiFi Could Become an Invisible Mass Surveillance System
1r2mm4c,6,Interview assignment/homework dilemma
1r2mfz3,4,How a single unpatched SAP flaw cost JLR £1.9B and halted 5 countries of production in late 2025.
1r2m4sp,4,"AI helps scam centres evade crackdown in Asia, dupe more victims"
